imdb_id,actors,country,director,dvd,imdb_rating,imdb_votes,language,metascore,plot,poster,production,rated,released,runtime,title,tomato_consensus,tomato_image,tomato_meter,tomato_rating,tomato_reviews,tomato_rotten,tomato_user_meter,tomato_user_rating,tomato_user_reviews,writer,year,budget,genres,homepage,tmdb_id,overview,tmdb_popularity,revenue,tagline,tmdb_vote_average,tmdb_vote_count,wiki_page
tt1964418,"George Clooney, Hugh Laurie, Britt Robertson, Raffey Cassidy","USA, Spain",Brad Bird,13 Oct 2015,6.5,"127,535","English, French, Japanese",60,"Bound by a shared destiny, a teen bursting with scientific curiosity and a former boy-genius inventor embark on a mission to unearth the secrets of a place somewhere in time and space that exists in their collective memory.",http://ia.media-imdb.com/images/M/MV5BMTQ0MDc5MjAyNF5BMl5BanBnXkFtZTgwMzU5Mzk1NjE@._V1_SX300.jpg,Walt Disney Pictures,PG,22 May 2015,130 min,Tomorrowland,"Ambitious and visually stunning, Tomorrowland is unfortunately weighted down by uneven storytelling.",rotten,50,5.9,249,125,50,3.3,87079,"Damon Lindelof (screenplay), Brad Bird (screenplay), Damon Lindelof (story by), Brad Bird (story by), Jeff Jensen (story by)",2015,190000000,"[Action, Adventure, Family, Mystery, Science Fiction]",http://movies.disney.com/tomorrowland,158852,"Bound by a shared destiny, a bright, optimistic teen bursting with scientific curiosity and a former boy-genius inventor jaded by disillusionment embark on a danger-filled mission to unearth the secrets of an enigmatic place somewhere in time and space that exists in their collective memory as ""Tomorrowland.""",6.000465,209035668,Imagine a world where nothing is impossible.,6.2,1648,Tomorrowland (film)
tt3079380,"Jude Law, Raad Rawi, Melissa McCarthy, Jessica Chaffin",USA,Paul Feig,29 Sep 2015,7.1,"167,366","English, French, Italian, German",75,"A desk-bound CIA analyst volunteers to go undercover to infiltrate the world of a deadly arms dealer, and prevent diabolical global disaster.",http://ia.media-imdb.com/images/M/MV5BNjI5OTQ0MDQxM15BMl5BanBnXkFtZTgwMzcwNjMyNTE@._V1_SX300.jpg,20th Century Fox,R,05 Jun 2015,119 min,Spy,"Simultaneously broad and progressive, Spy offers further proof that Melissa McCarthy and writer-director Paul Feig bring out the best in one another -- and delivers scores of belly laughs along the way.",certified,94,7.2,226,14,79,3.9,80775,Paul Feig,2015,65000000,"[Action, Comedy, Crime]",http://www.foxmovies.com/movies/spy,238713,"A desk-bound CIA analyst volunteers to go undercover to infiltrate the world of a deadly arms dealer, and prevent diabolical global disaster.",1.956996,235666219,One of the guys. One of the Spies.,7.0,1648,Digital Spy
tt2322441,"Dakota Johnson, Jamie Dornan, Jennifer Ehle, Eloise Mumford",USA,Sam Taylor-Johnson,,4.1,"218,080",English,46,"Literature student Anastasia Steele's life changes forever when she meets handsome, yet tormented, billionaire Christian Grey.",http://ia.media-imdb.com/images/M/MV5BMjE1MTM4NDAzOF5BMl5BanBnXkFtZTgwNTMwNjI0MzE@._V1_SX300.jpg,,R,13 Feb 2015,125 min,Fifty Shades of Grey,"While creatively better endowed than its print counterpart, Fifty Shades of Grey is a less than satisfying experience on the screen.",rotten,25,4.2,242,182,42,2.9,81723,"Kelly Marcel (screenplay), E.L. James (novel)",2015,40000000,"[Drama, Romance]",https://www.facebook.com/fiftyshadesofgreymovie,216015,"When college senior Anastasia Steele steps in for her sick roommate to interview prominent businessman Christian Grey for their campus paper, little does she realize the path her life will take. Christian, as enigmatic as he is rich and powerful, finds himself strangely drawn to Ana, and she to him. Though sexually inexperienced, Ana plunges headlong into an affair -- and learns that Christian's true sexual proclivities push the boundaries of pain and pleasure.",2.992861,569651467,Are you curious?,5.3,1617,Fifty Shades of Grey (film)
tt2381941,"Will Smith, Margot Robbie, Adrian Martinez, Gerald McRaney","USA, Argentina","Glenn Ficarra, John Requa",02 Jun 2015,6.6,"148,421","English, Spanish",56,"In the midst of veteran con man Nicky's latest scheme, a woman from his past - now an accomplished femme fatale - shows up and throws his plans for a loop.",http://ia.media-imdb.com/images/M/MV5BMTUwODg2OTA4OF5BMl5BanBnXkFtZTgwOTE5MTE4MzE@._V1_SX300.jpg,Warner Bros. Pictures,R,27 Feb 2015,105 min,Focus,"Focus may have a few too many twists and turns, but it nearly skates by on its glamorous setting and the charm of its stars.",rotten,56,5.8,196,87,53,3.3,45312,"Glenn Ficarra, John Requa",2015,50100000,"[Romance, Comedy, Crime, Drama]",http://focusmovie.com/,256591,"A veteran grifter takes a young, attractive woman under his wing, but things get complicated when they become romantically involved.",2.608678,153962963,Never Drop The Con.,6.7,1592,Focus
tt4046784,"Dylan O'Brien, Ki Hong Lee, Kaya Scodelario, Thomas Brodie-Sangster",USA,Wes Ball,15 Dec 2015,6.4,"131,707",English,43,"After having escaped the Maze, the Gladers now face a new set of challenges on the open roads of a desolate landscape filled with unimaginable obstacles.",http://ia.media-imdb.com/images/M/MV5BMjE3MDU2NzQyMl5BMl5BanBnXkFtZTgwMzQxMDQ3NTE@._V1_SX300.jpg,20th Century Fox,PG-13,18 Sep 2015,132 min,The Scorch Trials,"Maze Runner: The Scorch Trials is an action-packed sequel at the cost of story, urgency, and mystery that the original offered.",rotten,49,5.4,127,65,55,3.4,60891,"T.S. Nowlin (screenplay), James Dashner (novel)",2015,61000000,"[Action, Science Fiction, Thriller]",http://mazerunnermovies.com,294254,"Thomas and his fellow Gladers face their greatest challenge yet: searching for clues about the mysterious and powerful organization known as WCKD. Their journey takes them to the Scorch, a desolate landscape filled with unimaginable obstacles. Teaming up with resistance fighters, the Gladers take on WCKD’s vastly superior forces and uncover its shocking plans for them all.",4.930679,311256926,The Maze Was Just the Beginning.,6.4,1548,Maze Runner: The Scorch Trials
tt2637276,"Mark Wahlberg, Seth MacFarlane, Amanda Seyfried, Jessica Barth",USA,Seth MacFarlane,15 Dec 2015,6.4,"113,821",English,48,"Newlywed couple Ted and Tami-Lynn want to have a baby, but in order to qualify to be a parent, Ted will have to prove he's a person in a court of law.",http://ia.media-imdb.com/images/M/MV5BMjEwMDg3MDk1NF5BMl5BanBnXkFtZTgwNjYyODA1NTE@._V1_SX300.jpg,Universal Pictures,R,26 Jun 2015,115 min,Ted 2,"Ted 2 reunites Mark Wahlberg and Seth MacFarlane for another round of sophomoric, scatological humor -- and just as before, your enjoyment will depend on your tolerance for all of the above.",rotten,46,5.3,186,100,51,3.3,64075,"Seth MacFarlane, Alec Sulkin, Wellesley Wild, Seth MacFarlane (based on characters created by)",2015,68000000,[Comedy],,214756,"Newlywed couple Ted and Tami-Lynn want to have a baby, but in order to qualify to be a parent, Ted will have to prove he's a person in a court of law.",5.205015,215863606,"Ted is Coming, Again.",6.4,1462,Ted 2
tt2446042,"Liam Neeson, Forest Whitaker, Famke Janssen, Maggie Grace",France,Olivier Megaton,21 Apr 2015,6.0,"132,832","English, Russian",26,"Ex-government operative Bryan Mills is accused of a ruthless murder he never committed or witnessed. As he is tracked and pursued, Mills brings out his particular set of skills to find the true killer and clear his name.",http://ia.media-imdb.com/images/M/MV5BNjM5MDU3NTY0M15BMl5BanBnXkFtZTgwOTk2ODU2MzE@._V1_SX300.jpg,20th Century Fox,PG-13,09 Jan 2015,109 min,Taken 3,"Hampered by toothless PG-13 action sequences, incoherent direction, and a hackneyed plot, Taken 3 serves as a clear signal that it's well past time to retire this franchise.",rotten,11,3.5,105,93,44,3.1,67643,"Luc Besson, Robert Mark Kamen, Luc Besson (characters), Robert Mark Kamen (characters)",2014,48000000,"[Crime, Action, Thriller]",http://www.taken3movie.com/,260346,"Ex-government operative Bryan Mills finds his life is shattered when he's falsely accused of a murder that hits close to home. As he's pursued by a savvy police inspector, Mills employs his particular set of skills to track the real killer and exact his unique brand of justice.",4.900894,325771424,It Ends Here,6.1,1412,Taken 3
tt1502712,"Miles Teller, Michael B. Jordan, Kate Mara, Jamie Bell",USA,Josh Trank,15 Dec 2015,4.3,"109,633",English,27,Four young outsiders teleport to an alternate and dangerous universe which alters their physical form in shocking ways. The four must learn to harness their new abilities and work together to save Earth from a former friend turned enemy.,http://ia.media-imdb.com/images/M/MV5BMTk0OTMyMDA0OF5BMl5BanBnXkFtZTgwMzY5NTkzNTE@._V1_SX300.jpg,20th Century Fox,PG-13,07 Aug 2015,100 min,Fantastic Four,"Dull and downbeat, this Fantastic Four proves a woefully misguided attempt to translate a classic comic series without the humor, joy, or colorful thrills that made it great.",rotten,9,3.4,216,197,19,2.1,136669,"Jeremy Slater (screenplay), Simon Kinberg (screenplay), Josh Trank (screenplay), Stan Lee (Marvel comic book), Jack Kirby (Marvel comic book)",2015,120000001,"[Action, Adventure, Science Fiction]",http://www.fantasticfourmovie.com/,166424,"Four young outsiders teleport to a dangerous universe, which alters their physical form in shocking ways. Their lives irrevocably upended, the team must learn to harness their daunting new abilities and work together to save Earth from a former friend turned enemy.",3.040946,167977596,Change is coming.,4.4,1391,Fantastic Four in film
tt2120120,"Adam Sandler, Kevin James, Michelle Monaghan, Peter Dinklage","USA, China, Canada",Chris Columbus,27 Oct 2015,5.6,"89,004",English,27,"When aliens misinterpret video feeds of classic arcade games as a declaration of war, they attack the Earth in the form of the video games.",http://ia.media-imdb.com/images/M/MV5BMTYxMzM4NDY5N15BMl5BanBnXkFtZTgwNzg1NTI3MzE@._V1_SX300.jpg,Sony Pictures,PG-13,24 Jul 2015,106 min,Pixels,"Much like the worst arcade games from the era that inspired it, Pixels has little replay value and is hardly worth a quarter.",rotten,16,3.8,170,142,47,3.1,68715,"Tim Herlihy (screenplay), Timothy Dowling (screenplay), Tim Herlihy (screen story), Patrick Jean (short film)",2015,88000000,"[Action, Comedy, Science Fiction]",http://www.pixels-movie.com/,257344,Video game experts are recruited by the military to fight 1980s-era video game characters who've attacked New York.,6.173242,243637091,Game On.,5.8,1367,Pixels (2010 film)
tt1638355,"Henry Cavill, Armie Hammer, Alicia Vikander, Elizabeth Debicki","USA, UK",Guy Ritchie,17 Nov 2015,7.3,"174,428","English, Russian, German, Italian",56,"In the early 1960s, CIA agent Napoleon Solo and KGB operative Illya Kuryakin participate in a joint mission against a mysterious criminal organization, which is working to proliferate nuclear weapons.",http://ia.media-imdb.com/images/M/MV5BMTc2NjQ4ODYyNF5BMl5BanBnXkFtZTgwODA3OTU5NTE@._V1_SX300.jpg,Warner Bros. Pictures,PG-13,14 Aug 2015,116 min,The Man from U.N.C.L.E.,"The Man from U.N.C.L.E. tries to distract from an unremarkable story with charismatic stars and fizzy set pieces, adding up to an uneven action thriller with just enough style to overcome its lack of substance.",fresh,67,6.2,234,78,74,3.7,45843,"Guy Ritchie (screenplay), Lionel Wigram (screenplay), Jeff Kleeman (story), David C. Wilson (story), Guy Ritchie (story), Lionel Wigram (story), Sam Rolfe (television series)",2015,75000000,"[Comedy, Action, Adventure]",,203801,"At the height of the Cold War, a mysterious criminal organization plans to use nuclear weapons and technology to upset the fragile balance of power between the United States and Soviet Union. CIA agent Napoleon Solo and KGB agent Illya Kuryakin are forced to put aside their hostilities and work together to stop the evildoers in their tracks. The duo's only lead is the daughter of a missing German scientist, whom they must find soon to prevent a global catastrophe.",3.370032,108145109,Saving the world never goes out of style.,7.0,1298,The Man from U.N.C.L.E. (film)
tt3682448,"Mark Rylance, Domenick Lombardozzi, Victor Verhaeghe, Mark Fichera","USA, Germany, India",Steven Spielberg,02 Feb 2016,7.6,"176,806","English, German, Russian",81,"During the Cold War, an American lawyer is recruited to defend an arrested Soviet spy in court, and then help the CIA facilitate an exchange of the spy for the Soviet captured American U2 spy plane pilot, Francis Gary Powers.",http://ia.media-imdb.com/images/M/MV5BMjIxOTI0MjU5NV5BMl5BanBnXkFtZTgwNzM4OTk4NTE@._V1_SX300.jpg,Dreamworks Pictures,PG-13,16 Oct 2015,142 min,Bridge of Spies,"Bridge of Spies finds new life in Hollywood's classic Cold War espionage thriller formula, thanks to reliably outstanding work from Steven Spielberg and Tom Hanks.",certified,92,7.8,259,22,87,4.0,62451,"Matt Charman, Ethan Coen, Joel Coen",2015,40000000,"[Thriller, Drama]",,296098,"During the Cold War, the Soviet Union captures U.S. pilot Francis Gary Powers after shooting down his U-2 spy plane. Sentenced to 10 years in prison, Powers' only hope is New York lawyer James Donovan, recruited by a CIA operative to negotiate his release. Donovan boards a plane to Berlin, hoping to win the young man's freedom through a prisoner exchange. If all goes well, the Russians would get Rudolf Abel, the convicted spy who Donovan defended in court.",2.736611,165478348,"In the shadow of war, one man showed the world what we stood for.",7.0,1295,List of accolades received by Bridge of Spies (film)
tt1661199,"Cate Blanchett, Lily James, Richard Madden, Helena Bonham Carter","USA, UK",Kenneth Branagh,15 Sep 2015,7.0,"103,212",English,67,"When her father unexpectedly passes away, young Ella finds herself at the mercy of her cruel stepmother and her scheming step-sisters. Never one to give up hope, Ella's fortunes begin to change after meeting a dashing stranger.",http://ia.media-imdb.com/images/M/MV5BMjMxODYyODEzN15BMl5BanBnXkFtZTgwMDk4OTU0MzE@._V1_SX300.jpg,Walt Disney Pictures,PG,13 Mar 2015,105 min,Cinderella,"Refreshingly traditional in a revisionist era, Kenneth Branagh's Cinderella proves Disney hasn't lost any of its old-fashioned magic.",certified,83,7.1,211,35,78,3.9,75955,Chris Weitz (screenplay),2015,95000000,"[Romance, Fantasy, Family, Drama]",,150689,"When her father unexpectedly passes away, young Ella finds herself at the mercy of her cruel stepmother and her daughters. Never one to give up hope, Ella's fortunes begin to change after meeting a dashing stranger in the woods.",4.287853,542351353,Midnight is just the beginning.,6.8,1276,Cinderella (1979 film)
tt3397884,"Emily Blunt, Benicio Del Toro, Josh Brolin, Victor Garber",USA,Denis Villeneuve,05 Jan 2016,7.6,"193,224","English, Spanish",81,An idealistic FBI agent is enlisted by a government task force to aid in the escalating war against drugs at the border area between the U.S. and Mexico.,http://ia.media-imdb.com/images/M/MV5BMjA5NjM3NTk1M15BMl5BanBnXkFtZTgwMzg1MzU2NjE@._V1_SX300.jpg,Lionsgate,R,02 Oct 2015,121 min,Sicario,"Led by outstanding work from Emily Blunt and Benicio del Toro, Sicario is a taut, tightly wound thriller with much more on its mind than attention-getting set pieces.",certified,93,8.0,229,15,85,4.0,62101,Taylor Sheridan,2015,30000000,"[Action, Crime, Drama, Mystery, Thriller]",,273481,"A young female FBI agent joins a secret CIA operation to take down a Mexican cartel boss, a job that ends up pushing her ethical and moral values to the limit.",3.171034,84025816,"The deeper you go, the darker it gets.",7.0,1202,Sicario (2015 film)
tt1798684,"Jake Gyllenhaal, Rachel McAdams, Forest Whitaker, Oona Laurence","USA, Hong Kong",Antoine Fuqua,,7.5,"143,457",English,57,Boxer Billy Hope turns to trainer Tick Wills to help him get his life back on track after losing his wife in a tragic accident and his daughter to child protection services.,http://ia.media-imdb.com/images/M/MV5BMjI1MTcwODk0MV5BMl5BanBnXkFtZTgwMTgwMDM5NTE@._V1_SX300.jpg,,R,24 Jul 2015,124 min,Southpaw,"Jake Gyllenhaal delivers an impressively committed performance, but Southpaw beats it down with a dispiriting drama that pummels viewers with genre clichÃ©s.",fresh,61,6.0,207,81,76,3.8,42753,Kurt Sutter,2015,30000000,"[Action, Drama]",,307081,"Billy ""The Great"" Hope, the reigning junior middleweight boxing champion, has an impressive career, a loving wife and daughter, and a lavish lifestyle. However, when tragedy strikes, Billy hits rock bottom, losing his family, his house and his manager. He soon finds an unlikely savior in Tick Willis, a former fighter who trains the city's toughest amateur boxers. With his future on the line, Hope fights to reclaim the trust of those he loves the most.",3.596906,91709679,Believe in Hope.,7.3,1178,Southpaw (film)
tt1895587,"Mark Ruffalo, Michael Keaton, Rachel McAdams, Liev Schreiber","USA, Canada",Tom McCarthy,23 Feb 2016,8.1,"192,275",English,93,"The true story of how the Boston Globe uncovered the massive scandal of child molestation and cover-up within the local Catholic Archdiocese, shaking the entire Catholic Church to its core.",http://ia.media-imdb.com/images/M/MV5BMjIyOTM5OTIzNV5BMl5BanBnXkFtZTgwMDkzODE2NjE@._V1_SX300.jpg,Open Road Films,R,25 Nov 2015,128 min,Spotlight,"Spotlight gracefully handles the lurid details of its fact-based story while resisting the temptation to lionize its heroes, resulting in a drama that honors the audience as well as its real-life subjects.",certified,96,8.8,283,11,93,4.3,62869,"Josh Singer, Tom McCarthy",2015,20000000,"[Drama, Thriller, History]",http://www.spotlightthefilm.com,314365,"The true story of how The Boston Globe uncovered the massive scandal of child molestation and cover-up within the local Catholic Archdiocese, shaking the entire Catholic Church to its core.",2.660478,88346473,Break the story. Break the silence.,7.8,1165,List of accolades received by Spotlight (film)
tt1596363,"Ryan Gosling, Rudy Eisenzopf, Casey Groves, Charlie Talbert",USA,Adam McKay,,7.8,"179,248",English,81,"Four denizens in the world of high-finance predict the credit and housing bubble collapse of the mid-2000s, and decide to take on the big banks for their greed and lack of foresight.",http://ia.media-imdb.com/images/M/MV5BNzlhOTRmZjgtN2YyOS00MjI0LWJiNmMtODQyNTJjNDY1YWU3XkEyXkFqcGdeQXVyMzg2MzE2OTE@._V1_SX300.jpg,,R,23 Dec 2015,130 min,The Big Short,"The Big Short approaches a serious, complicated subject with an impressive attention to detail -- and manages to deliver a well-acted, scathingly funny indictment of its real-life villains in the bargain.",certified,88,7.8,274,33,88,4.1,63982,"Charles Randolph (screenplay), Adam McKay (screenplay), Michael Lewis (book)",2015,28000000,"[Drama, Comedy]",http://www.thebigshortmovie.com/,318846,The men who made millions from a global economic meltdown.,3.43297,133346506,This is a true story.,7.2,1119,The Big Short (film)
tt2848292,"Anna Kendrick, Rebel Wilson, Hailee Steinfeld, Brittany Snow",USA,Elizabeth Banks,22 Sep 2015,6.5,"97,050",English,63,"After a humiliating command performance at The Kennedy Center, the Barden Bellas enter an international competition that no American group has ever won in order to regain their status and right to perform.",http://ia.media-imdb.com/images/M/MV5BMTk0Mzg4NDYyOF5BMl5BanBnXkFtZTgwOTM2ODg2NTE@._V1_SX300.jpg,Universal Pictures,PG-13,15 May 2015,115 min,Pitch Perfect 2,"Pitch Perfect 2 sings in sweet comedic harmony, even if it doesn't hit quite as many high notes as its predecessor.",fresh,66,6.0,187,64,65,3.6,78271,"Kay Cannon, Mickey Rapkin (based on the book by)",2015,29000000,"[Comedy, Music]",,254470,"The Bellas are back, and they are better than ever. After being humiliated in front of none other than the President of the United States of America, the Bellas are taken out of the Aca-Circuit. In order to clear their name, and regain their status, the Bellas take on a seemingly impossible task: winning an international competition no American team has ever won. In order to accomplish this monumental task, they need to strengthen the bonds of friendship and sisterhood and blow away the competition with their amazing aca-magic! With all new friends and old rivals tagging along for the trip, the Bellas can hopefully accomplish their dreams.",3.692608,286633264,We're back pitches,6.8,1107,Pitch Perfect 2
tt3170832,"Brie Larson, Jacob Tremblay, Sean Bridgers, Wendy Crewson","Ireland, Canada, USA",Lenny Abrahamson,01 Mar 2016,8.3,"157,486",English,86,A young boy is raised within the confines of a small shed.,http://ia.media-imdb.com/images/M/MV5BMjE4NzgzNzEwMl5BMl5BanBnXkFtZTgwMTMzMDE0NjE@._V1_SX300.jpg,Element Pictures,R,22 Jan 2016,118 min,Room,"Led by incredible work from Brie Larson and Jacob Tremblay, Room makes for an unforgettably harrowing -- and undeniably rewarding -- experience.",certified,94,8.4,256,16,93,4.4,44617,"Emma Donoghue (screenplay), Emma Donoghue (novel)",2015,6000000,"[Drama, Thriller]",http://www.roomthemovie.com,264644,Jack is a young boy of 5 years old who has lived all his life in one room. He believes everything within it are the only real things in the world. But what will happen when his Ma suddenly tells him that there are other things outside of Room?,3.779224,35401758,Love knows no boundaries,8.1,1097,Room
tt3622592,"Nat Wolff, Cara Delevingne, Austin Abrams, Justice Smith",USA,Jake Schreier,20 Oct 2015,6.4,"62,944",English,56,"After an all night adventure, Quentin's life-long crush, Margo, disappears, leaving behind clues that Quentin and his friends follow on the journey of a lifetime.",http://ia.media-imdb.com/images/M/MV5BMjE2ODQxODMwOF5BMl5BanBnXkFtZTgwNDY5NjY3NDE@._V1_SX300.jpg,20th Century Fox,PG-13,24 Jul 2015,109 min,Paper Towns,"Paper Towns isn't as deep or moving as it wants to be, yet it's still earnest, well-acted, and thoughtful enough to earn a place in the hearts of teen filmgoers of all ages.",rotten,56,5.8,128,56,48,3.2,32351,"John Green (book), Scott Neustadter (screenplay), Michael H. Weber (screenplay)",2015,12000000,"[Drama, Mystery, Romance]",,286565,"Quentin Jacobsen has spent a lifetime loving the magnificently adventurous Margo Roth Spiegelman from afar. So when she cracks open a window and climbs back into his life-dressed like a ninja and summoning him for an ingenious campaign of revenge-he follows. After their all-nighter ends and a new day breaks, Q arrives at school to discover that Margo, always an enigma, has now become a mystery. But Q soon learns that there are clues-and they're for him. Urged down a disconnected path, the closer he gets, the less Q sees of the girl he thought he knew.",3.046759,85512300,Get Lost. Get Found.,6.4,1064,Paper Towns (film)
tt2719848,"Jason Clarke, Ang Phula Sherpa, Thomas M. Wright, Martin Henderson","UK, USA, Iceland",Baltasar Kormákur,19 Jan 2016,7.1,"133,670","English, Russian",64,A climbing expedition on Mt. Everest is devastated by a severe snow storm.,http://ia.media-imdb.com/images/M/MV5BMjMzMjIxOTIxMl5BMl5BanBnXkFtZTgwNTk4NDI0NjE@._V1_SX300.jpg,Universal Pictures,PG-13,25 Sep 2015,121 min,Everest,"Everest boasts all the dizzying cinematography a person could hope to get out a movie about mountain climbers, even if it's content to tread less challenging narrative terrain.",fresh,73,6.7,201,54,69,3.6,46410,"William Nicholson (screenplay), Simon Beaufoy (screenplay)",2015,55000000,"[Adventure, Drama]",http://www.everestmovie.com/,253412,"Inspired by the incredible events surrounding a treacherous attempt to reach the summit of the world's highest mountain, ""Everest"" documents the awe-inspiring journey of two different expeditions challenged beyond their limits by one of the fiercest snowstorms ever encountered by mankind. Their mettle tested by the harshest of elements found on the planet, the climbers will face nearly impossible obstacles as a lifelong obsession becomes a breathtaking struggle for survival.",2.752054,202394678,The Storm Awaits.,6.6,999,Mount Everest
tt2361509,"Robert De Niro, Anne Hathaway, Rene Russo, Anders Holm",USA,Nancy Meyers,19 Jan 2016,7.2,"125,510",English,51,"70-year-old widower Ben Whittaker has discovered that retirement isn't all it's cracked up to be. Seizing an opportunity to get back in the game, he becomes a senior intern at an online fashion site, founded and run by Jules Ostin.",http://ia.media-imdb.com/images/M/MV5BMTUyNjE5NjI5OF5BMl5BanBnXkFtZTgwNzYzMzU3NjE@._V1_SX300.jpg,Warner Bros. Pictures,PG-13,25 Sep 2015,121 min,The Intern,"The Intern doesn't do enough with its timely premise, but benefits from the unorthodox chemistry of its talented leads.",fresh,61,5.8,168,65,74,3.8,43224,Nancy Meyers,2015,35000000,[Comedy],http://www.theinternmovie.com/,257211,"70-year-old widower Ben Whittaker has discovered that retirement isn't all it's cracked up to be. Seizing an opportunity to get back in the game, he becomes a senior intern at an online fashion site, founded and run by Jules Ostin.",4.265794,194564672,Experience never gets old,7.1,999,The Intern (2015 film)
