imdb_id,actors,country,director,dvd,imdb_rating,imdb_votes,language,metascore,plot,poster,production,rated,released,runtime,title,tomato_consensus,tomato_image,tomato_meter,tomato_rating,tomato_reviews,tomato_rotten,tomato_user_meter,tomato_user_rating,tomato_user_reviews,writer,year,budget,genres,homepage,tmdb_id,overview,tmdb_popularity,revenue,tagline,tmdb_vote_average,tmdb_vote_count,wiki_page
tt1392190,"Tom Hardy, Charlize Theron, Nicholas Hoult, Hugh Keays-Byrne","Australia, USA",George Miller,01 Sep 2015,8.1,"547,810","English, Russian",90,"A woman rebels against a tyrannical ruler in postapocalyptic Australia in search for her home-land with the help of a group of female prisoners, a psychotic worshipper, and a drifter named Max.",http://ia.media-imdb.com/images/M/MV5BMTUyMTE0ODcxNF5BMl5BanBnXkFtZTgwODE4NDQzNTE@._V1_SX300.jpg,Warner Bros.,R,15 May 2015,120 min,Mad Max: Fury Road,"With exhilarating action and a surprising amount of narrative heft, Mad Max: Fury Road brings George Miller's post-apocalyptic franchise roaring vigorously back to life.",certified,97,8.6,354,12,86,4.2,119588,"George Miller, Brendan McCarthy, Nick Lathouris",2015,150000000,"[Action, Adventure, Science Fiction, Thriller]",http://www.madmaxmovie.com/,76341,"An apocalyptic story set in the furthest reaches of our planet, in a stark desert landscape where humanity is broken, and most everyone is crazed fighting for the necessities of life. Within this world exist two rebels on the run who just might be able to restore order. There's Max, a man of action and a man of few words, who seeks peace of mind following the loss of his wife and child in the aftermath of the chaos. And Furiosa, a woman of action and a woman who believes her path to survival may be achieved if she can make it across the desert back to her childhood homeland.",17.391762,378436354,What a Lovely Day.,7.3,5062,Mad Max: Fury Road
tt0369610,"Chris Pratt, Bryce Dallas Howard, Irrfan Khan, Vincent D'Onofrio",USA,Colin Trevorrow,20 Oct 2015,7.0,"416,573",English,59,A new theme park is built on the original site of Jurassic Park. Everything is going well until the park's newest attraction - a genetically modified giant stealth killing machine - escapes containment and goes on a killing spree.,http://ia.media-imdb.com/images/M/MV5BMTQ5MTE0MTk3Nl5BMl5BanBnXkFtZTgwMjczMzk2NTE@._V1_SX300.jpg,Universal Pictures,PG-13,12 Jun 2015,124 min,Jurassic World,"Jurassic World can't match the original for sheer inventiveness and impact, but it works in its own right as an entertaining -- and visually dazzling -- popcorn thriller.",fresh,72,6.7,295,84,78,3.9,222015,"Rick Jaffa (screenplay), Amanda Silver (screenplay), Colin Trevorrow (screenplay), Derek Connolly (screenplay), Rick Jaffa (story), Amanda Silver (story), Michael Crichton (characters)",2015,150000000,"[Action, Adventure, Science Fiction, Thriller]",http://www.jurassicworld.com/,135397,"Twenty-two years after the events of Jurassic Park, Isla Nublar now features a fully functioning dinosaur theme park, Jurassic World, as originally envisioned by John Hammond.",15.079174,1513528810,The park is open.,6.6,4809,Jurassic World
tt2488496,"Harrison Ford, Mark Hamill, Carrie Fisher, Adam Driver",USA,J.J. Abrams,05 Apr 2016,8.2,"561,678",English,81,"Three decades after the defeat of the Galactic Empire, a new threat arises. The First Order attempts to rule the galaxy and only a ragtag group of heroes can stop them, along with the help of the Resistance.",http://ia.media-imdb.com/images/M/MV5BOTAzODEzNDAzMl5BMl5BanBnXkFtZTgwMDU1MTgzNzE@._V1_SX300.jpg,Walt Disney Pictures,PG-13,18 Dec 2015,136 min,Star Wars: The Force Awakens,"Packed with action and populated by both familiar faces and fresh blood, The Force Awakens successfully recalls the series' former glory while injecting it with renewed energy.",certified,92,8.2,358,28,89,4.3,217825,"Lawrence Kasdan, J.J. Abrams, Michael Arndt, George Lucas (based on characters created by)",2015,200000000,"[Action, Adventure, Science Fiction, Fantasy]",http://www.starwars.com/films/star-wars-episode-vii,140607,"Thirty years after defeating the Galactic Empire, Han Solo and his allies face a new threat from the evil Kylo Ren and his army of Stormtroopers.",7.435354,2068178225,Every generation has a story.,7.6,4575,Star Wars: The Force Awakens
tt2395427,"Robert Downey Jr., Chris Hemsworth, Mark Ruffalo, Chris Evans",USA,Joss Whedon,02 Oct 2015,7.5,"459,751",English,66,"When Tony Stark and Bruce Banner try to jump-start a dormant peacekeeping program called Ultron, things go horribly wrong and it's up to Earth's Mightiest Heroes to stop the villainous Ultron from enacting his terrible plans.",http://ia.media-imdb.com/images/M/MV5BMTM4OGJmNWMtOTM4Ni00NTE3LTg3MDItZmQxYjc4N2JhNmUxXkEyXkFqcGdeQXVyNTgzMDMzMTg@._V1_SX300.jpg,Walt Disney Pictures,PG-13,01 May 2015,141 min,Avengers: Age of Ultron,"Exuberant and eye-popping, Avengers: Age of Ultron serves as an overstuffed but mostly satisfying sequel, reuniting its predecessor's unwieldy cast with a few new additions and a worthy foe.",certified,75,6.7,307,77,84,4.1,282188,"Joss Whedon, Stan Lee (based on the Marvel comics by), Jack Kirby (based on the Marvel comics by)",2015,250000000,"[Action, Adventure, Science Fiction]",http://marvel.com/movies/movie/193/avengers_age_of_ultron,99861,"When Tony Stark tries to jumpstart a dormant peacekeeping program, things go awry and Earth’s Mightiest Heroes are put to the ultimate test as the fate of the planet hangs in the balance. As the villainous Ultron emerges, it is up to The Avengers to stop him from enacting his terrible plans, and soon uneasy alliances and unexpected action pave the way for an epic and unique global adventure.",4.558371,1405035767,A New Age Has Come.,7.4,3850,Avengers: Age of Ultron
tt3659388,"Matt Damon, Jessica Chastain, Kristen Wiig, Jeff Daniels","USA, UK",Ridley Scott,12 Jan 2016,8.1,"467,360","English, Mandarin",80,"An astronaut becomes stranded on Mars after his team assume him dead, and must rely on his ingenuity to find a way to signal to Earth that he is alive.",http://ia.media-imdb.com/images/M/MV5BMTc2MTQ3MDA1Nl5BMl5BanBnXkFtZTgwODA3OTI4NjE@._V1_SX300.jpg,20th Century Fox,PG-13,02 Oct 2015,144 min,The Martian,"Smart, thrilling, and surprisingly funny, The Martian offers a faithful adaptation of the bestselling book that brings out the best in leading man Matt Damon and director Ridley Scott.",certified,92,7.8,310,25,92,4.3,126198,"Drew Goddard (screenplay), Andy Weir (book)",2015,108000000,"[Drama, Adventure, Science Fiction]",http://www.foxmovies.com/movies/the-martian,286217,"During a manned mission to Mars, Astronaut Mark Watney is presumed dead after a fierce storm and left behind by his crew. But Watney has survived and finds himself stranded and alone on the hostile planet. With only meager supplies, he must draw upon his ingenuity, wit and spirit to subsist and find a way to signal to Earth that he is alive.",8.373647,595380321,Bring Him Home,7.6,3828,The Martian (film)
tt2096673,"Amy Poehler, Phyllis Smith, Richard Kind, Bill Hader",USA,"Pete Docter, Ronnie Del Carmen",03 Nov 2015,8.3,"342,328",English,94,"After young Riley is uprooted from her Midwest life and moved to San Francisco, her emotions - Joy, Fear, Anger, Disgust and Sadness - conflict on how best to navigate a new city, house, and school.",http://ia.media-imdb.com/images/M/MV5BOTgxMDQwMDk0OF5BMl5BanBnXkFtZTgwNjU5OTg2NDE@._V1_SX300.jpg,Disney/Pixar,PG,19 Jun 2015,95 min,Inside Out,"Inventive, gorgeously animated, and powerfully moving, Inside Out is another outstanding addition to the Pixar library of modern animated classics.",certified,98,8.9,315,6,89,4.3,129878,"Pete Docter (original story by), Ronnie Del Carmen (original story by), Pete Docter (screenplay), Meg LeFauve (screenplay), Josh Cooley (screenplay), Michael Arndt (additional story material by), Bill Hader (additional dialogue by), Amy Poehler (additional dialogue by), Simon Rich (additional story material by)",2015,175000000,"[Comedy, Animation, Family]",http://movies.disney.com/inside-out,150540,"Growing up can be a bumpy road, and it's no exception for Riley, who is uprooted from her Midwest life when her father starts a new job in San Francisco. Like all of us, Riley is guided by her emotions - Joy, Fear, Anger, Disgust and Sadness. The emotions live in Headquarters, the control center inside Riley's mind, where they help advise her through everyday life. As Riley and her emotions struggle to adjust to a new life in San Francisco, turmoil ensues in Headquarters. Although Joy, Riley's main and most important emotion, tries to keep things positive, the emotions conflict on how best to navigate a new city, house and school.",5.63192,857427711,Meet the little voices inside your head.,8.0,3346,Inside Out (2015 film)
tt0478970,"Paul Rudd, Michael Douglas, Evangeline Lilly, Corey Stoll",USA,Peyton Reed,08 Dec 2015,7.4,"310,184",English,64,"Armed with a super-suit with the astonishing ability to shrink in scale but increase in strength, cat burglar Scott Lang must embrace his inner hero and help his mentor, Dr. Hank Pym, plan and pull off a heist that will save the world.",http://ia.media-imdb.com/images/M/MV5BMjM2NTQ5Mzc2M15BMl5BanBnXkFtZTgwNTcxMDI2NTE@._V1_SX300.jpg,Disney/Marvel,PG-13,17 Jul 2015,117 min,Ant-Man,"Led by a charming performance from Paul Rudd, Ant-Man offers Marvel thrills on an appropriately smaller scale -- albeit not as smoothly as its most successful predecessors.",certified,81,6.8,270,52,86,4.0,160345,"Edgar Wright (screenplay), Joe Cornish (screenplay), Adam McKay (screenplay), Paul Rudd (screenplay), Edgar Wright (story by), Joe Cornish (story by), Stan Lee (based on the comics by), Larry Lieber (based on the comics by), Jack Kirby (based on the comics by)",2015,130000000,"[Science Fiction, Action, Adventure]",http://marvel.com/movies/movie/180/ant-man,102899,"Armed with the astonishing ability to shrink in scale but increase in strength, con-man Scott Lang must embrace his inner-hero and help his mentor, Dr. Hank Pym, protect the secret behind his spectacular Ant-Man suit from a new generation of towering threats. Against seemingly insurmountable obstacles, Pym and Lang must plan and pull off a heist that will save the world.",6.030112,518178306,Heroes Don't Get Any Bigger,6.9,3327,Ant-Man (film)
tt1663202,"Leonardo DiCaprio, Tom Hardy, Domhnall Gleeson, Will Poulter","USA, Hong Kong, Taiwan, Canada",Alejandro G. Iñárritu,19 Apr 2016,8.1,"399,974","English, Pawnee, French",76,A frontiersman on a fur trading expedition in the 1820s fights for survival after being mauled by a bear and left for dead by members of his own hunting team.,http://ia.media-imdb.com/images/M/MV5BMjU4NDExNDM1NF5BMl5BanBnXkFtZTgwMDIyMTgxNzE@._V1_SX300.jpg,20th Century Fox,R,08 Jan 2016,156 min,The Revenant,"As starkly beautiful as it is harshly uncompromising, The Revenant uses Leonardo DiCaprio's committed performance as fuel for an absorbing drama that offers punishing challenges -- and rich rewards.",certified,82,7.9,311,56,85,4.1,99939,"Mark L. Smith (screenplay), Alejandro G. Iñárritu (screenplay), Michael Punke (based in part on the novel by)",2015,135000000,"[Western, Drama, Adventure, Thriller]",http://www.foxmovies.com/movies/the-revenant,281957,"In the 1820s, a frontiersman, Hugh Glass, sets out on a path of vengeance against those who left him for dead after a bear mauling.",6.397272,532925985,"(n. One who has returned, as if from the dead.)",7.1,3153,The Revenant (2015 film)
tt2379713,"Daniel Craig, Christoph Waltz, Léa Seydoux, Ralph Fiennes","UK, USA",Sam Mendes,09 Feb 2016,6.8,"269,609","English, Spanish, Italian, German, French",60,"A cryptic message from Bond's past sends him on a trail to uncover a sinister organization. While M battles political forces to keep the secret service alive, Bond peels back the layers of deceit to reveal the terrible truth behind SPECTRE.",http://ia.media-imdb.com/images/M/MV5BMjM2Nzg4MzkwOF5BMl5BanBnXkFtZTgwNzA0OTE3NjE@._V1_SX300.jpg,Sony Pictures,PG-13,06 Nov 2015,148 min,Spectre,"Spectre nudges Daniel Craig's rebooted Bond closer to the glorious, action-driven spectacle of earlier entries, although it's admittedly reliant on established 007 formula.",fresh,65,6.5,305,107,62,3.5,104171,"John Logan (screenplay), Neal Purvis (screenplay), Robert Wade (screenplay), Jez Butterworth (screenplay), John Logan (story), Neal Purvis (story), Robert Wade (story), Ian Fleming (characters)",2015,245000000,"[Action, Adventure, Crime]",http://www.sonypictures.com/movies/spectre/,206647,"A cryptic message from Bond’s past sends him on a trail to uncover a sinister organization. While M battles political forces to keep the secret service alive, Bond peels back the layers of deceit to reveal the terrible truth behind SPECTRE.",6.452969,880674609,A Plan No One Escapes,6.2,2885,Spectre (2015 film)
tt2293640,"Sandra Bullock, Jon Hamm, Michael Keaton, Allison Janney",USA,"Kyle Balda, Pierre Coffin",08 Dec 2015,6.4,"141,188","English, Spanish",56,"Minions Stuart, Kevin and Bob are recruited by Scarlet Overkill, a super-villain who, alongside her inventor husband Herb, hatches a plot to take over the world.",http://ia.media-imdb.com/images/M/MV5BMTg2MTMyMzU0M15BMl5BanBnXkFtZTgwOTU3ODk4NTE@._V1_SX300.jpg,Universal Pictures,PG,10 Jul 2015,91 min,Minions,"The Minions' brightly colored brand of gibberish-fueled insanity stretches to feature length in their self-titled Despicable Me spinoff, with uneven but often hilarious results.",rotten,56,5.8,196,86,49,3.3,134953,Brian Lynch,2015,74000000,"[Family, Animation, Adventure, Comedy]",http://www.minionsmovie.com/,211672,"Minions Stuart, Kevin and Bob are recruited by Scarlet Overkill, a super-villain who, alongside her inventor husband Herb, hatches a plot to take over the world.",7.839636,1156730962,"Before Gru, they had a history of bad bosses",6.6,2645,Minions (film)
tt2820852,"Vin Diesel, Paul Walker, Jason Statham, Michelle Rodriguez","USA, Japan",James Wan,15 Sep 2015,7.3,"277,247",English,67,Deckard Shaw seeks revenge against Dominic Toretto and his family for his comatose brother.,http://ia.media-imdb.com/images/M/MV5BMTQxOTA2NDUzOV5BMl5BanBnXkFtZTgwNzY2MTMxMzE@._V1_SX300.jpg,Universal Pictures,PG-13,03 Apr 2015,137 min,Furious 7,"Serving up a fresh round of over-the-top thrills while adding unexpected dramatic heft, Furious 7 keeps the franchise moving in more ways than one.",certified,80,6.7,231,46,83,4.1,193503,"Chris Morgan, Gary Scott Thompson (characters)",2015,190000000,"[Action, Crime, Thriller]",http://www.furious7.com/,168259,Deckard Shaw seeks revenge against Dominic Toretto and his family for his comatose brother.,11.172003,1506249360,Vengeance Hits Home,7.4,2636,Furious 7
tt0470752,"Domhnall Gleeson, Corey Johnson, Oscar Isaac, Alicia Vikander",UK,Alex Garland,14 Jul 2015,7.7,"282,661",English,78,A young programmer is selected to participate in a ground-breaking experiment in synthetic intelligence by evaluating the human qualities of a breath-taking humanoid A.I.,http://ia.media-imdb.com/images/M/MV5BMTUxNzc0OTIxMV5BMl5BanBnXkFtZTgwNDI3NzU2NDE@._V1_SX300.jpg,A24 Films,R,24 Apr 2015,108 min,Ex Machina,"Ex Machina leans heavier on ideas than effects, but it's still a visually polished piece of work -- and an uncommonly engaging sci-fi feature.",certified,93,8.1,231,17,86,4.1,67843,Alex Garland,2015,15000000,"[Drama, Science Fiction]",http://exmachina-movie.com/,264660,"Caleb, a 26 year old coder at the world's largest internet company, wins a competition to spend a week at a private mountain retreat belonging to Nathan, the reclusive CEO of the company. But when Caleb arrives at the remote location he finds that he will have to participate in a strange and fascinating experiment in which he must interact with the world's first true artificial intelligence, housed in the body of a beautiful robot girl.",3.887178,36869414,There is nothing more human than the will to survive,7.6,2337,Ex Machina (film)
tt1340138,"Arnold Schwarzenegger, Jason Clarke, Emilia Clarke, Jai Courtney",USA,Alan Taylor,10 Nov 2015,6.6,"187,290",English,38,"When John Connor, leader of the human resistance, sends Sgt. Kyle Reese back to 1984 to protect Sarah Connor and safeguard the future, an unexpected turn of events creates a fractured timeline.",http://ia.media-imdb.com/images/M/MV5BMjM1NTc0NzE4OF5BMl5BanBnXkFtZTgwNDkyNjQ1NTE@._V1_SX300.jpg,Paramount Pictures,PG-13,01 Jul 2015,126 min,Terminator Genisys,"Mired in its muddled mythology, Terminator: Genisys is a lurching retread that lacks the thematic depth, conceptual intelligence, or visual thrills that launched this once-mighty franchise.",rotten,26,4.7,231,172,55,3.3,80902,"Laeta Kalogridis, Patrick Lussier, James Cameron (characters), Gale Anne Hurd (characters)",2015,155000000,"[Science Fiction, Action, Thriller, Adventure]",http://www.terminatormovie.com/,87101,"The year is 2029. John Connor, leader of the resistance continues the war against the machines. At the Los Angeles offensive, John's fears of the unknown future begin to emerge when TECOM spies reveal a new plot by SkyNet that will attack him from both fronts; past and future, and will ultimately change warfare forever.",13.62367,440603537,Reset the future,5.9,2265,Terminator Genisys
tt2381249,"Tom Cruise, Jeremy Renner, Simon Pegg, Rebecca Ferguson","China, Hong Kong, USA",Christopher McQuarrie,15 Dec 2015,7.4,"227,586","English, Swedish, German",75,"Ethan and team take on their most impossible mission yet, eradicating the Syndicate - an International rogue organization as highly skilled as they are, committed to destroying the IMF.",http://ia.media-imdb.com/images/M/MV5BMTQ1NDI2MzU2MF5BMl5BanBnXkFtZTgwNTExNTU5NDE@._V1_SX300.jpg,Paramount Pictures,PG-13,31 Jul 2015,131 min,Mission: Impossible - Rogue Nation,Mission: Impossible Rogue Nation continues the franchise's thrilling resurgence -- and proves that Tom Cruise remains an action star without equal.,certified,93,7.5,274,19,87,4.1,90618,"Christopher McQuarrie (screenplay), Christopher McQuarrie (story), Drew Pearce (story), Bruce Geller (television series)",2015,150000000,[Action],http://www.missionimpossible.com,177677,"Ethan and team take on their most impossible mission yet, eradicating the Syndicate - an International rogue organization as highly skilled as they are, committed to destroying the IMF.",4.902094,682330139,Desperate Times. Desperate Measures.,7.1,2114,Mission: Impossible (film series)
tt2908446,"Kate Winslet, Jai Courtney, Mekhi Phifer, Shailene Woodley",USA,Robert Schwentke,04 Aug 2015,6.3,"153,764",English,42,Beatrice Prior must confront her inner demons and continue her fight against a powerful alliance which threatens to tear her society apart with the help from others on her side.,http://ia.media-imdb.com/images/M/MV5BMTgxOTYxMTg3OF5BMl5BanBnXkFtZTgwMDgyMzA2NDE@._V1_SX300.jpg,Lionsgate Films,PG-13,20 Mar 2015,119 min,Insurgent,"Shailene Woodley gives it her all, but Insurgent is still a resounding step back for a franchise struggling to distinguish itself from the dystopian YA crowd.",rotten,29,5.1,182,130,59,3.5,75891,"Brian Duffield (screenplay), Akiva Goldsman (screenplay), Mark Bomback (screenplay), Veronica Roth (novel)",2015,110000000,"[Adventure, Science Fiction, Thriller]",http://www.thedivergentseries.movie/#insurgent,262500,Beatrice Prior must confront her inner demons and continue her fight against a powerful alliance which threatens to tear her society apart.,6.798516,295238201,One Choice Can Destroy You,6.4,2082,The Divergent Series: Insurgent
tt1951266,"Jennifer Lawrence, Josh Hutcherson, Liam Hemsworth, Woody Harrelson","USA, Germany",Francis Lawrence,22 Mar 2016,6.6,"164,674",English,65,"As the war of Panem escalates to the destruction of other districts, Katniss Everdeen, the reluctant leader of the rebellion, must bring together an army against President Snow, while all she holds dear hangs in the balance.",http://ia.media-imdb.com/images/M/MV5BNjQzNDI2NTU1Ml5BMl5BanBnXkFtZTgwNTAyMDQ5NjE@._V1_SX300.jpg,Lionsgate Films,PG-13,20 Nov 2015,137 min,The Hunger Games: Mockingjay - Part 2,"With the unflinchingly grim Mockingjay Part 2, The Hunger Games comes to an exciting, poignant, and overall satisfying conclusion.",fresh,70,6.5,246,74,66,3.6,200335,"Peter Craig (screenplay), Danny Strong (screenplay), Suzanne Collins (adaptation), Suzanne Collins (novel)",2015,160000000,"[War, Adventure, Science Fiction]",http://www.thehungergames.movie/,131634,"With the nation of Panem in a full scale war, Katniss confronts President Snow in the final showdown. Teamed with a group of her closest friends – including Gale, Finnick, and Peeta – Katniss goes off on a mission with the unit from District 13 as they risk their lives to stage an assassination attempt on President Snow who has become increasingly obsessed with destroying her. The mortal traps, enemies, and moral choices that await Katniss will challenge her more than any arena she faced in The Hunger Games.",6.59842,639827109,The fire will burn forever.,6.6,1954,The Hunger Games (film series)
tt3460252,"Samuel L. Jackson, Kurt Russell, Jennifer Jason Leigh, Walton Goggins",USA,Quentin Tarantino,29 Mar 2016,7.9,"270,363","English, Spanish",68,"In the dead of a Wyoming winter, a bounty hunter and his prisoner find shelter in a cabin currently inhabited by a collection of nefarious characters.",http://ia.media-imdb.com/images/M/MV5BMjA1MTc1NTg5NV5BMl5BanBnXkFtZTgwOTM2MDEzNzE@._V1_SX300.jpg,The Weinstein Company,R,30 Dec 2015,187 min,The Hateful Eight,"The Hateful Eight offers another well-aimed round from Quentin Tarantino's signature blend of action, humor, and over-the-top violence -- all while demonstrating an even stronger grip on his filmmaking craft.",certified,75,7.3,268,68,76,3.8,67970,Quentin Tarantino,2015,44000000,"[Crime, Drama, Mystery, Western]",http://thehatefuleight.com/,273248,Bounty hunters seek shelter from a raging blizzard and get caught up in a plot of betrayal and deception.,6.106036,155760117,No one comes up here without a damn good reason.,7.3,1894,The Hateful Eight
tt2126355,"Dwayne Johnson, Carla Gugino, Alexandra Daddario, Ioan Gruffudd",USA,Brad Peyton,20 Oct 2015,6.1,"144,800",English,43,"In the aftermath of a massive earthquake in California, a rescue-chopper pilot makes a dangerous journey with his ex-wife across the state in order to rescue his daughter.",http://ia.media-imdb.com/images/M/MV5BNjI4MTgyOTAxOV5BMl5BanBnXkFtZTgwMjQwOTA4NTE@._V1_SX300.jpg,Warner Bros.,PG-13,27 May 2015,114 min,San Andreas,"San Andreas has a great cast and outstanding special effects, but amidst all the senses-shattering destruction, the movie's characters and plot prove less than structurally sound.",rotten,48,5.2,210,109,52,3.3,64739,"Carlton Cuse (screenplay), Andre Fabrizio (story), Jeremy Passmore (story), Carlton Cuse, Andre Fabrizio",2015,110000000,"[Action, Drama, Thriller]",http://www.sanandreasmovie.com/,254128,"In the aftermath of a massive earthquake in California, a rescue-chopper pilot makes a dangerous journey across the state in order to rescue his estranged daughter.",5.424179,470490832,"A rescue pilot survived an earthquake, this is what happens next",6.1,1832,San Andreas (film)
tt1823672,"Sharlto Copley, Dev Patel, Ninja, Yo-Landi Visser","USA, South Africa",Neill Blomkamp,16 Jun 2015,6.9,"170,109",English,41,"In the near future, crime is patrolled by a mechanized police force. When one police droid, Chappie, is stolen and given new programming, he becomes the first robot with the ability to think and feel for himself.",http://ia.media-imdb.com/images/M/MV5BMTUyNTI4NTIwNl5BMl5BanBnXkFtZTgwMjQ4MTI0NDE@._V1_SX300.jpg,Sony Pictures,R,06 Mar 2015,120 min,Chappie,"Chappie boasts more of the big ideas and visual panache that director Neill Blomkamp has become known for -- and, sadly, more of the narrative shortcomings.",rotten,32,4.9,195,133,56,3.4,48464,"Neill Blomkamp, Terri Tatchell",2015,49000000,"[Crime, Action, Science Fiction]",http://www.chappie-movie.com,198184,"Every child comes into the world full of promise, and none more so than Chappie: he is gifted, special, a prodigy. Like any child, Chappie will come under the influence of his surroundings—some good, some bad—and he will rely on his heart and soul to find his way in the world and become his own man. But there's one thing that makes Chappie different from any one else: he is a robot.",8.344765,102069268,I am consciousness. I am alive. I am Chappie.,6.6,1757,Chappie (film)
tt1617661,"Mila Kunis, Channing Tatum, Sean Bean, Eddie Redmayne","USA, Australia","Lana Wachowski, Lilly Wachowski",02 Jun 2015,5.4,"137,915","English, Russian",40,A young woman discovers her destiny as an heiress of intergalactic nobility and must fight to protect the inhabitants of Earth from an ancient and destructive industry.,http://ia.media-imdb.com/images/M/MV5BMTQyNzk2MjA2NF5BMl5BanBnXkFtZTgwMjEwNzk3MjE@._V1_SX300.jpg,Warner Bros. Pictures,PG-13,06 Feb 2015,127 min,Jupiter Ascending,"Pleasing to the eye but narratively befuddled, Jupiter Ascending delivers another visually thrilling misfire from the Wachowskis.",rotten,26,4.3,228,169,38,2.9,94484,"Lilly Wachowski, Lana Wachowski",2015,176000003,"[Science Fiction, Fantasy, Action, Adventure]",http://www.jupiterascending.com,76757,"In a universe where human genetic material is the most precious commodity, an impoverished young Earth woman becomes the key to strategic maneuvers and internal strife within a powerful dynasty…",5.148165,183987723,Expand your universe.,5.3,1739,Jupiter Ascending
