imdb_id,adult,backdrop_path,belongs_to_collection,budget,genres,homepage,tmdb_id,original_language,original_title,overview,tmdb_popularity,poster_path,production_companies,production_countries,release_date,revenue,runtime,spoken_languages,status,tagline,title,video,tmdb_vote_average,tmdb_vote_count
tt0983193,False,/m3xgF9JiTlfN1rO9hcvTd4PTIQy.jpg,"{u'backdrop_path': u'/5r4lg0gOZV4hQzyAYZKTUS9DNqe.jpg', u'poster_path': u'/oKM5pYPGCCh11uBd8fMiKQVqOo8.jpg', u'id': 240670, u'name': u'The Adventures of Tintin Collection'}",130000000,"[Adventure, Animation, Action, Family, Mystery]",http://www.us.movie.tintin.com/,17578,en,The Adventures of Tintin,"Intrepid young reporter Tintin and his loyal dog Snowy are thrust into a world of high adventure when they discover a ship carrying an explosive secret. As Tintin is drawn into a centuries-old mystery, Ivan Ivanovitch Sakharine suspects him of stealing a priceless treasure. Tintin and Snowy, with the help of salty, cantankerous Captain Haddock, and bumbling detectives Thompson &amp; Thomson, travel half the world, one step ahead of their enemies as Tintin endeavors to find The Unicorn, a sunken ship that may hold a vast fortune, but also an ancient curse.",1.595623,/bDE10SyVAFEBrwI6qettdCHQjT.jpg,"[{u'name': u'Paramount Pictures', u'id': 4}, {u'name': u'Columbia Pictures', u'id': 5}, {u'name': u'WingNut Films', u'id': 11}, {u'name': u'Amblin Entertainment', u'id': 56}, {u'name': u'Nickelodeon Movies', u'id': 2348}, {u'name': u'Kennedy/Marshall Company, The', u'id': 7383}, {u'name': u'Hemisphere Media Capital', u'id': 9169}]","[{u'iso_3166_1': u'NZ', u'name': u'New Zealand'}, {u'iso_3166_1': u'US', u'name': u'United States of America'}]",2011-10-25,371940071,107,"[{u'iso_639_1': u'en', u'name': u'English'}]",Released,"This year, discover how far adventure will take you.",The Adventures of Tintin,False,6.6,1329
tt1650062,False,/9gh3kcihkCH5EWjxBtb19pdQxhm.jpg,,50000000,"[Thriller, Science Fiction, Mystery]",http://www.super8-movie.com/,37686,en,Super 8,"In 1979 Ohio, several youngsters are making a zombie movie with a Super-8 camera. In the midst of filming, the friends witness a horrifying train derailment and are lucky to escape with their lives. They soon discover that the catastrophe was no accident, as a series of unexplained events and disappearances soon follows. Deputy Jackson Lamb, the father of one of the kids, searches for the terrifying truth behind the crash.",1.595014,/orkLSuIsWxi2AIGXaCf7CL45T68.jpg,"[{u'name': u'Paramount Pictures', u'id': 4}, {u'name': u'Amblin Entertainment', u'id': 56}, {u'name': u'Bad Robot', u'id': 11461}, {u'name': u'K/O Camera Toys', u'id': 23300}]","[{u'iso_3166_1': u'US', u'name': u'United States of America'}]",2011-06-08,260095987,112,"[{u'iso_639_1': u'en', u'name': u'English'}]",Released,It Arrives.,Super 8,False,6.5,1327
tt1192628,False,/fX6o5DCdGVEEZ1OT1IourOUkQMb.jpg,,135000000,"[Animation, Comedy, Family, Western, Adventure]",http://www.rangomovie.com/,44896,en,Rango,"When Rango, a lost family pet, accidentally winds up in the gritty, gun-slinging town of Dirt, the less-than-courageous lizard suddenly finds he stands out. Welcomed as the last hope the town has been waiting for, new Sheriff Rango is forced to play his new role to the hilt.",1.274891,/afxRbCwwKjrWgGJtsVNs1BW1Dk5.jpg,"[{u'name': u'Paramount Pictures', u'id': 4}, {u'name': u'Nickelodeon Movies', u'id': 2348}, {u'name': u'GK Films', u'id': 3281}, {u'name': u'Blind Wink', u'id': 10262}, {u'name': u'Paramount Animation', u'id': 24955}]","[{u'iso_3166_1': u'US', u'name': u'United States of America'}]",2011-03-02,245724603,107,"[{u'iso_639_1': u'en', u'name': u'English'}]",Released,Heroes come in all different colors.,Rango,False,6.5,1265
tt1499658,False,/1iVZJmeHW8MVMq7xlaHgLSv6qrc.jpg,"{u'backdrop_path': u'/9RD8qHYKr3KAJcaXp4t5SbMN4aQ.jpg', u'poster_path': u'/zU3dVVBa3JW1nQVUsaFM0BeTnK.jpg', u'id': 280588, u'name': u'Horrible Bosses Collection'}",35000000,"[Comedy, Crime]",http://horriblebossesmovie.warnerbros.com/index.html,51540,en,Horrible Bosses,"For Nick (Jason Bateman), Kurt (Jason Sudeikis) and Dale (Charlie Day), the only thing that would make the daily grind more tolerable would be to grind their intolerable bosses (Kevin Spacey, Colin Farrell, Jennifer Aniston) into dust. Quitting is not an option, so, with the benefit of a few-too-many drinks and some dubious advice from a hustling ex-con (Jamie Foxx), the three friends devise a convoluted and seemingly foolproof plan to rid themselves of their respective employers... permanently.",1.362258,/17rVRW7ond0PR2KJHY0xY00isTB.jpg,"[{u'name': u'New Line Cinema', u'id': 12}, {u'name': u'Rat Entertainment', u'id': 12007}]","[{u'iso_3166_1': u'US', u'name': u'United States of America'}]",2011-07-08,117000000,98,"[{u'iso_639_1': u'en', u'name': u'English'}]",Released,Ever wish your boss was dead?,Horrible Bosses,False,6.4,1238
tt0409847,False,/gTDwoJBCu7scwYQoykIlLNpkCes.jpg,,163000000,"[Action, Science Fiction, Thriller, Western]",http://www.cowboysandaliensmovie.com/,49849,en,Cowboys & Aliens,"A stranger stumbles into the desert town of Absolution with no memory of his past and a futuristic shackle around his wrist. With the help of mysterious beauty Ella and the iron-fisted Colonel Dolarhyde, he finds himself leading an unlikely posse of cowboys, outlaws, and Apache warriors against a common enemy from beyond this world in an epic showdown for survival.",1.372031,/tXEHvxU315Yu7bEaMMRcpDpW6RI.jpg,"[{u'name': u'Imagine Entertainment', u'id': 23}, {u'name': u'DreamWorks SKG', u'id': 27}, {u'name': u'Universal Pictures', u'id': 33}, {u'name': u'platinum studios', u'id': 7218}, {u'name': u'Reliance Entertainment', u'id': 7294}, {u'name': u'Relativity Media', u'id': 7295}, {u'name': u'K/O Paper Products', u'id': 7296}, {u'name': u'Fairview Entertainment', u'id': 7297}, {u'name': u'K/O Camera Toys', u'id': 23300}]","[{u'iso_3166_1': u'US', u'name': u'United States of America'}]",2011-07-29,174822325,119,"[{u'iso_639_1': u'en', u'name': u'English'}]",Released,First Contact. Last Stand.,Cowboys & Aliens,False,5.4,1224
tt1632708,False,/liq5ljqURqLiBUgMkNiR388ZuSH.jpg,,35000000,[Comedy],http://www.fwb-movie.com/,50544,en,Friends with Benefits,"While trying to avoid the clichés of Hollywood romantic comedies, Dylan and Jamie soon discover however that adding the act of sex to their friendship does lead to complications.",1.465412,/tmVuyRSS9RYFs73YGbMnFous7DH.jpg,"[{u'name': u'Castle Rock Entertainment', u'id': 97}, {u'name': u'Screen Gems', u'id': 3287}, {u'name': u'Olive Bridge Entertainment', u'id': 7291}]","[{u'iso_3166_1': u'US', u'name': u'United States of America'}]",2011-07-21,150483765,109,"[{u'iso_639_1': u'en', u'name': u'English'}]",Released,Some friends come with a happy ending.,Friends with Benefits,False,6.4,1184
tt1216475,False,/jEcmZhtJkZQc6ta2vzBd9CU7GIx.jpg,"{u'backdrop_path': u'/A8DqaTGwZ8iCEjWMNRsZumzfKLw.jpg', u'poster_path': u'/uq3N2SFj1Y06zA6LzCQPkmBdaaE.jpg', u'id': 87118, u'name': u'Cars Collection'}",200000000,"[Animation, Family, Adventure, Comedy]",http://www.disney.go.com/cars/,49013,en,Cars 2,Star race car Lightning McQueen and his pal Mater head overseas to compete in the World Grand Prix race. But the road to the championship becomes rocky as Mater gets caught up in an intriguing adventure of his own: international espionage.,2.055473,/AblhtULOVtrkSnFxRPQ8gBemxw9.jpg,"[{u'name': u'Walt Disney Pictures', u'id': 2}, {u'name': u'Pixar Animation Studios', u'id': 3}]","[{u'iso_3166_1': u'US', u'name': u'United States of America'}]",2011-06-11,559852396,106,"[{u'iso_639_1': u'en', u'name': u'English'}, {u'iso_639_1': u'ja', u'name': u'日本語'}, {u'iso_639_1': u'it', u'name': u'Italiano'}, {u'iso_639_1': u'fr', u'name': u'Français'}]",Released,Ka-ciao!,Cars 2,False,5.8,1179
tt0970179,False,/jc3qQh8FV2YOJc8z7JQlXmv33Zs.jpg,,170000000,"[Adventure, Drama, Family]",http://www.hugomovie.com/,44826,en,Hugo,"Hugo is an orphan boy living in the walls of a train station in 1930s Paris. He learned to fix clocks and other gadgets from his father and uncle which he puts to use keeping the train station clocks running. The only thing that he has left that connects him to his dead father is an automaton (mechanical man) that doesn't work without a special key which Hugo needs to find to unlock the secret he believes it contains. On his adventures, he meets with a shopkeeper, George Melies, who works in the train station and his adventure-seeking god-daughter. Hugo finds that they have a surprising connection to his father and the automaton, and he discovers it unlocks some memories the old man has buried inside regarding his past.",1.253123,/fkeaJr29ypea1n24gzspsc7qK44.jpg,"[{u'name': u'Paramount Pictures', u'id': 4}, {u'name': u'Infinitum Nihil', u'id': 2691}, {u'name': u'GK Films', u'id': 3281}]","[{u'iso_3166_1': u'US', u'name': u'United States of America'}]",2011-11-22,185770160,126,"[{u'iso_639_1': u'en', u'name': u'English'}]",Released,One of the most legendary directors of our time takes you on an extraordinary adventure.,Hugo,False,6.8,1122
tt1302011,False,/eyiE1vuizMKVu8MoZkg2xsramFl.jpg,"{u'backdrop_path': u'/uDosHOFFWtF5YteBRygHALFqLw2.jpg', u'poster_path': u'/2QT6PuYXY0T2Ry9rX0JKQYTrbwx.jpg', u'id': 77816, u'name': u'Kung Fu Panda Collection'}",150000000,"[Animation, Family]",http://www.kungfupanda.com/,49444,en,Kung Fu Panda 2,"Po is now living his dream as The Dragon Warrior, protecting the Valley of Peace alongside his friends and fellow kung fu masters, The Furious Five - Tigress, Crane, Mantis, Viper and Monkey. But Po’s new life of awesomeness is threatened by the emergence of a formidable villain, who plans to use a secret, unstoppable weapon to conquer China and destroy kung fu. It is up to Po and The Furious Five to journey across China to face this threat and vanquish it. But how can Po stop a weapon that can stop kung fu? He must look to his past and uncover the secrets of his mysterious origins; only then will he be able to unlock the strength he needs to succeed.",1.749063,/9wCrh57WO3mPmn1hWnJRcvdFtIb.jpg,"[{u'name': u'DreamWorks Animation', u'id': 521}]","[{u'iso_3166_1': u'US', u'name': u'United States of America'}]",2011-05-25,665692281,91,"[{u'iso_639_1': u'en', u'name': u'English'}]",Released,Prepare for the Year of Awesomeness!,Kung Fu Panda 2,False,6.6,1052
tt1385826,False,/iE2WiPdF7a0s5glgXQBBmZQ6mUd.jpg,,50200000,"[Thriller, Romance, Fantasy]",http://www.theadjustmentbureau.com/,38050,en,The Adjustment Bureau,"A man glimpses the future Fate has planned for him – and chooses to fight for his own destiny. Battling the powerful Adjustment Bureau across, under and through the streets of New York, he risks his destined greatness to be with the only woman he's ever loved.",1.993119,/g87PqGH9Oo3d3Tbczcfk7ZMAIEk.jpg,"[{u'name': u'Universal Pictures', u'id': 33}, {u'name': u'Media Rights Capital', u'id': 2531}, {u'name': u'Gambit Pictures', u'id': 6933}, {u'name': u'Electric Shepherd Productions', u'id': 11834}]","[{u'iso_3166_1': u'US', u'name': u'United States of America'}]",2011-03-03,127869379,106,"[{u'iso_639_1': u'en', u'name': u'English'}]",Released,Fight for your fate.,The Adjustment Bureau,False,6.4,996
tt1092026,False,/mFSmjVtZ9hsU8RQm4Cda3fG7SaD.jpg,,40000000,"[Adventure, Comedy, Science Fiction]",http://paulthemovie.co.uk/,39513,en,Paul,"For the past 60 years, a space-traveling smart-ass named Paul has been locked up in a top-secret military base, advising world leaders about his kind. But when he worries he’s outlived his usefulness and the dissection table is drawing uncomfortably close, Paul escapes on the first RV that passes by his compound in Area 51. Fortunately, it contains the two earthlings who are most likely to rescue and harbor an alien on the run.",2.161313,/297N75COL0NsJJY5k5U8VTJ1DCe.jpg,"[{u'name': u'Universal Pictures', u'id': 33}, {u'name': u'Big Talk Productions', u'id': 443}, {u'name': u'Relativity Media', u'id': 7295}, {u'name': u'Working Title Films', u'id': 10163}]","[{u'iso_3166_1': u'US', u'name': u'United States of America'}, {u'iso_3166_1': u'GB', u'name': u'United Kingdom'}]",2011-02-14,97552050,104,"[{u'iso_639_1': u'en', u'name': u'English'}]",Released,Who's up for a close encounter?,Paul,False,6.4,978
tt1217613,False,/eBcjJY0o7GErxmm8SYpslvtjRyM.jpg,,70000000,"[Action, Science Fiction]",http://www.battlela.com,44943,en,Battle: Los Angeles,"The Earth is attacked by unknown forces. As people everywhere watch the world's great cities fall, Los Angeles becomes the last stand for mankind in a battle no one expected. It's up to a Marine staff sergeant and his new platoon to draw a line in the sand as they take on an enemy unlike any they've ever encountered before.",0.948742,/eduBDZvRNGxvqsBgfzxyBgWMKlE.jpg,"[{u'name': u'Columbia Pictures', u'id': 5}, {u'name': u'Original Film', u'id': 333}, {u'name': u'Relativity Media', u'id': 7295}]","[{u'iso_3166_1': u'US', u'name': u'United States of America'}]",2011-03-08,202466756,116,"[{u'iso_639_1': u'en', u'name': u'English'}]",Released,It's not war. It's survival.,Battle: Los Angeles,False,5.5,961
tt1478338,False,/1J6s0TW6nhfjwoffzDL98Synw5H.jpg,,32500000,"[Romance, Comedy]",http://www.bridesmaidsmovie.com/,55721,en,Bridesmaids,"Annie’s life is a mess. But when she finds out her lifetime best friend is engaged, she simply must serve as Lillian’s maid of honor. Though lovelorn and broke, Annie bluffs her way through the expensive and bizarre rituals. With one chance to get it perfect, she’ll show Lillian and her bridesmaids just how far you’ll go for someone you love.",1.410689,/x5ucaJZ4FP589Gn3I8l3ZFV3Nl8.jpg,"[{u'name': u'Universal Pictures', u'id': 33}, {u'name': u'Relativity Media', u'id': 7295}, {u'name': u'Apatow Productions', u'id': 10105}]","[{u'iso_3166_1': u'US', u'name': u'United States of America'}]",2011-04-28,288383523,125,"[{u'iso_639_1': u'en', u'name': u'English'}]",Released,Save the date,Bridesmaids,False,6.5,950
tt1605783,False,/mtTKXG925gRdYHVto6cxC9NdfBZ.jpg,,30000000,"[Fantasy, Comedy, Romance]",http://www.sonyclassics.com/midnightinparis,59436,en,Midnight in Paris,A romantic comedy about a family traveling to the French capital for business. The party includes a young engaged couple forced to confront the illusion that a life different from their own is better.,1.608927,/xxSopLYATHXSepXcEaBh9Gazv6p.jpg,"[{u'name': u'Gravier Productions', u'id': 1824}, {u'name': u'Televisió de Catalunya (TV3)', u'id': 8530}, {u'name': u'Versátil Cinema', u'id': 8531}, {u'name': u'Mediapro', u'id': 12010}, {u'name': u'Pontchartrain Productions', u'id': 24785}]","[{u'iso_3166_1': u'ES', u'name': u'Spain'}, {u'iso_3166_1': u'US', u'name': u'United States of America'}]",2011-05-11,151119219,94,"[{u'iso_639_1': u'en', u'name': u'English'}, {u'iso_639_1': u'fr', u'name': u'Français'}, {u'iso_639_1': u'de', u'name': u'Deutsch'}, {u'iso_639_1': u'es', u'name': u'Español'}]",Released,,Midnight in Paris,False,7.2,939
tt1464540,False,/b6rXH9f1UMP01qtyN5LiBX4ubIU.jpg,,50000000,"[Action, Thriller, Science Fiction, Adventure]",http://www.findnumberfour.com/,46529,en,I Am Number Four,"A teenage fugitive with an incredible secret races to stay one step ahead of the mysterious forces seeking destroy him in this sci-fi action thriller. With three dead and one on the run, the race to find the elusive Number Four begins. Outwardly normal teen John Smith never gets too comfortable in the same identity, and along with his guardian, Henri, he is constantly moving from town to town. With each passing day, John gains a stronger grasp on his extraordinary new powers, and his bond to the beings that share his fantastic fate grows stronger.",1.120906,/36E6t6YgzT4mwgqNt5XbcV4MRNU.jpg,"[{u'name': u'DreamWorks SKG', u'id': 27}, {u'name': u'Reliance BIG Entertainment', u'id': 6733}, {u'name': u'Bay Films', u'id': 6734}, {u'name': u'Touchstone Pictures', u'id': 9195}]","[{u'iso_3166_1': u'US', u'name': u'United States of America'}]",2011-02-15,144492830,109,"[{u'iso_639_1': u'fr', u'name': u'Français'}, {u'iso_639_1': u'en', u'name': u'English'}]",Released,Three like him have already been killed…he is Number Four.,I Am Number Four,False,6.0,909
tt0978764,False,/hVpUs9zBGDuAG6RcTeHkBQshJkk.jpg,,82000000,"[Action, Fantasy, Thriller]",http://suckerpunchmovie.warnerbros.com,23629,en,Sucker Punch,"A young girl is institutionalized by her abusive stepfather. Retreating to an alternative reality as a coping strategy, she envisions a plan which will help her escape from the mental facility.",1.145064,/s5SjC5pXsBQG3wx9iVzaIzJzpFl.jpg,"[{u'name': u'Legendary Pictures', u'id': 923}, {u'name': u'Warner Bros.', u'id': 6194}, {u'name': u'Lennox House Films', u'id': 22119}, {u'name': u'Cruel and Unusual Films', u'id': 78685}]","[{u'iso_3166_1': u'US', u'name': u'United States of America'}]",2011-03-24,89792502,110,"[{u'iso_639_1': u'en', u'name': u'English'}, {u'iso_639_1': u'de', u'name': u'Deutsch'}]",Released,You Will Be Unprepared.,Sucker Punch,False,5.9,899
tt1454029,False,/dskiB6nk4VA9pmw20L9oN7I4tkO.jpg,,25000000,[Drama],http://thehelpmovie.com/#/splash,50014,en,The Help,"Aibileen Clark is a middle-aged African-American maid who has spent her life raising white children and has recently lost her only son; Minny Jackson is an African-American maid who has often offended her employers despite her family's struggles with money and her desperate need for jobs; and Eugenia ""Skeeter"" Phelan is a young white woman who has recently moved back home after graduating college to find out her childhood maid has mysteriously disappeared. These three stories intertwine to explain how life in Jackson, Mississippi revolves around ""the help""; yet they are always kept at a certain distance because of racial lines.",0.739094,/vTPN8vh3ith8nK6Du8ijjzyw04h.jpg,"[{u'name': u'DreamWorks SKG', u'id': 27}, {u'name': u'1492 Pictures', u'id': 436}, {u'name': u'Participant Productions', u'id': 2030}, {u'name': u'Imagenation Abu Dhabi FZ', u'id': 6736}, {u'name': u'Reliance Entertainment', u'id': 7294}, {u'name': u'Touchstone Pictures', u'id': 9195}]","[{u'iso_3166_1': u'IN', u'name': u'India'}, {u'iso_3166_1': u'AE', u'name': u'United Arab Emirates'}, {u'iso_3166_1': u'US', u'name': u'United States of America'}]",2011-08-09,124272124,146,"[{u'iso_639_1': u'en', u'name': u'English'}]",Released,Change begins with a whisper.,The Help,False,7.5,890
tt0448694,False,/iiufWukqR2QBfYIfP7OEdLHrYXB.jpg,"{u'backdrop_path': u'/feU1DWV5zMWxXUHJyAIk3dHRQ9c.jpg', u'poster_path': u'/anHwj9IupRoRZZ98WTBvHpTiE6A.jpg', u'id': 94602, u'name': u'Puss in Boots Collection'}",130000000,"[Comedy, Animation, Family, Fantasy, Action]",http://www.pussinbootsthemovie.com/,58423,en,Puss in Boots,"Long before he even met Shrek, the notorious fighter, lover and outlaw Puss in Boots becomes a hero when he sets off on an adventure with the tough and street smart Kitty Softpaws and the mastermind Humpty Dumpty to save his town. This is the true story of The Cat, The Myth, The Legend... The Boots.",2.207028,/zy48sYz5TZWC4itoOHaQnUfWKtP.jpg,"[{u'name': u'DreamWorks Animation', u'id': 521}]","[{u'iso_3166_1': u'US', u'name': u'United States of America'}]",2011-10-28,554987477,90,"[{u'iso_639_1': u'sk', u'name': u'Slovenčina'}, {u'iso_639_1': u'en', u'name': u'English'}, {u'iso_639_1': u'es', u'name': u'Español'}, {u'iso_639_1': u'pt', u'name': u'Português'}]",Released,Live for danger. Fight for justice. Pray for mercy.,Puss in Boots,False,6.2,885
