imdb_id,adult,backdrop_path,belongs_to_collection,budget,genres,homepage,tmdb_id,original_language,original_title,overview,tmdb_popularity,poster_path,production_companies,production_countries,release_date,revenue,runtime,spoken_languages,status,tagline,title,video,tmdb_vote_average,tmdb_vote_count
tt1956620,False,/USKXUGMT9PZHzq91F5Beuged7.jpg,,40000000,[Comedy],,225886,en,Sex Tape,"When Jay and Annie first got together, their romantic connection was intense – but ten years and two kids later, the flame of their love needs a spark.  To kick things up a notch, they decide – why not? – to make a video of themselves trying out every position in The Joy of Sex in one marathon three-hour session.  It seems like a great idea – until they discover that their most private video is no longer private.  With their reputations on the line, they know they’re just one click away from being laid bare to the world... but as their race to reclaim their video leads to a night they'll never forget, they'll find that their video will expose even more than they bargained for.",3.483079,/2BMmIPGu5ZbTrwXwomdSUuTB2Ul.jpg,"[{u'name': u'Escape Artists', u'id': 1423}, {u'name': u'Media Rights Capital', u'id': 2531}, {u'name': u'Sony Pictures Entertainment (SPE)', u'id': 7431}, {u'name': u'LStar Capital', u'id': 34034}]","[{u'iso_3166_1': u'US', u'name': u'United States of America'}]",2014-07-17,126069509,97,"[{u'iso_639_1': u'en', u'name': u'English'}]",Released,A movie about a movie they don't want you to see.,Sex Tape,False,5.4,1024
tt2557490,False,/tkxiEwG9xJIbyzvJSGYUyTkz3Mj.jpg,,0,"[Comedy, Western]",,188161,en,A Million Ways to Die in the West,"As a cowardly farmer begins to fall for the mysterious new woman in town, he must put his new-found courage to the test when her husband, a notorious gun-slinger, announces his arrival.",1.960655,/12fqfvUmBOPg2pA0RsEhc31P28O.jpg,"[{u'name': u'Media Rights Capital', u'id': 2531}, {u'name': u'Fuzzy Door Productions', u'id': 8789}, {u'name': u'Bluegrass Films', u'id': 27451}, {u'name': u'RGB Media', u'id': 31470}]","[{u'iso_3166_1': u'US', u'name': u'United States of America'}]",2014-05-22,0,116,"[{u'iso_639_1': u'en', u'name': u'English'}]",Released,Bring protection.,A Million Ways to Die in the West,False,5.9,990
tt2177771,False,/6AaXKJAigIsIAOtoayjHeDcBWoc.jpg,,70000000,"[War, Drama, History, Action]",http://www.monumentsmen.com/,152760,en,The Monuments Men,"Based on the true story of the greatest treasure hunt in history, The Monuments Men is an action drama focusing on seven over-the-hill, out-of-shape museum directors, artists, architects, curators, and art historians who went to the front lines of WWII to rescue the world’s artistic masterpieces from Nazi thieves and return them to their rightful owners.  With the art hidden behind enemy lines, how could these guys hope to succeed?",1.385915,/buKyrMjMaK78uFdZAbp5Wg3Eveq.jpg,"[{u'name': u'Columbia Pictures', u'id': 5}, {u'name': u'Studio Babelsberg', u'id': 264}, {u'name': u'Fox 2000 Pictures', u'id': 711}, {u'name': u'Smokehouse Pictures', u'id': 22695}, {u'name': u'Obelisk Productions', u'id': 24970}]","[{u'iso_3166_1': u'DE', u'name': u'Germany'}, {u'iso_3166_1': u'US', u'name': u'United States of America'}]",2014-01-24,154984035,118,"[{u'iso_639_1': u'en', u'name': u'English'}, {u'iso_639_1': u'de', u'name': u'Deutsch'}, {u'iso_639_1': u'ru', u'name': u'Pусский'}, {u'iso_639_1': u'fr', u'name': u'Français'}]",Released,It was the greatest art heist in history,The Monuments Men,False,5.7,980
tt2180411,False,/lzJzB0QfkjpGCm9qUC4XpEIB6pm.jpg,,50000000,"[Music, Family, Fantasy, Comedy]",,224141,en,Into the Woods,"A witch conspires to teach important lessons to various characters of popular children's stories including Little Red Riding Hood, Cinderella, Jack and the Beanstalk and Rapunzel.",2.044754,/5h91odPFNlBuJbRBj5N4MEBfXDE.jpg,"[{u'name': u'Walt Disney Pictures', u'id': 2}, {u'name': u'Marc Platt Productions', u'id': 2527}, {u'name': u'Lucamar Productions', u'id': 17021}, {u'name': u'Moving Picture Company (MPC)', u'id': 20478}, {u'name': u'Soho VFX', u'id': 54392}]","[{u'iso_3166_1': u'CA', u'name': u'Canada'}, {u'iso_3166_1': u'US', u'name': u'United States of America'}, {u'iso_3166_1': u'GB', u'name': u'United Kingdom'}]",2014-12-25,212902372,125,"[{u'iso_639_1': u'en', u'name': u'English'}]",Released,Be careful what you wish for,Into the Woods,False,5.6,963
tt2692250,False,/6tKleiKS54focE4z0sdtLOIEgK8.jpg,"{u'backdrop_path': u'/fOmqiIXfJmeANciOTCN6WkKbwK.jpg', u'poster_path': u'/q2nwE0Qi8U6tsU5HDmiWS2D3dSJ.jpg', u'id': 85943, u'name': u'Night at the Museum Collection'}",127000000,"[Adventure, Comedy, Fantasy, Family]",,181533,en,Night at the Museum: Secret of the Tomb,"When the magic powers of The Tablet of Ahkmenrah begin to die out, Larry Daley (Ben Stiller) spans the globe, uniting favorite and new characters while embarking on an epic quest to save the magic before it is gone forever.",3.754038,/tWwASv4CU1Au1IukacdSUewDCV3.jpg,"[{u'name': u'Twentieth Century Fox Film Corporation', u'id': 306}, {u'name': u'1492 Pictures', u'id': 436}, {u'name': u'21 Laps Entertainment', u'id': 2575}, {u'name': u'Moving Picture Company (MPC)', u'id': 20478}, {u'name': u'TSG Entertainment', u'id': 22213}]","[{u'iso_3166_1': u'GB', u'name': u'United Kingdom'}, {u'iso_3166_1': u'US', u'name': u'United States of America'}]",2014-12-17,349424282,97,"[{u'iso_639_1': u'en', u'name': u'English'}]",Released,One Final Night to Save the Day.,Night at the Museum: Secret of the Tomb,False,6.1,954
tt2397535,False,/s9DKwK5fXzaqFOzkZkidkOk4KR9.jpg,,5500000,"[Science Fiction, Thriller]",,206487,en,Predestination,"Predestination chronicles the life of a Temporal Agent sent on an intricate series of time-travel journeys designed to prevent future killers from committing their crimes. Now, on his final assignment, the Agent must stop the one criminal that has eluded him throughout time and prevent a devastating attack in which thousands of lives will be lost.",2.379896,/kDdUtDsGMQ3OYwoBtEQyJIGPz4V.jpg,"[{u'name': u'Screen Australia', u'id': 7584}, {u'name': u'Screen Queensland', u'id': 10950}, {u'name': u'Blacklab Entertainment', u'id': 15392}, {u'name': u'Wolfhound Pictures', u'id': 15393}]","[{u'iso_3166_1': u'AU', u'name': u'Australia'}]",2014-08-28,3000000,97,"[{u'iso_639_1': u'en', u'name': u'English'}]",Released,To save the future he must reshape the past.,Predestination,False,7.2,947
tt0435651,False,/9heGSxkxgVCo1yScmkIgvLL2ytD.jpg,,25000000,"[Drama, Science Fiction]",http://thegiverfilm.com/,227156,en,The Giver,"In a seemingly perfect community, without war, pain, suffering, differences or choice, a young boy is chosen to learn from an elderly man about the true pain and pleasure of the ""real"" world.",2.65545,/4g19qQ4pfQz6nlVctA0q3y7Dieg.jpg,"[{u'name': u'The Weinstein Company', u'id': 308}, {u'name': u'Walden Media', u'id': 10221}, {u'name': u'Tonik Productions', u'id': 17145}, {u'name': u'Asis Productions', u'id': 53464}]","[{u'iso_3166_1': u'US', u'name': u'United States of America'}]",2014-08-11,66980456,94,"[{u'iso_639_1': u'en', u'name': u'English'}]",Released,Search for truth. Find freedom.,The Giver,False,6.3,935
tt2203939,False,/mRv6kxqL1uIJSoVA8NzGOqBBacT.jpg,,40000000,"[Comedy, Romance]",,193610,en,The Other Woman,"After discovering her boyfriend is married, Carly soon meets the wife he's been cheating on. And when yet another affair is discovered, all three women team up to plot mutual revenge on the three-timing SOB.",1.503896,/fu7K3rPwJcScizlXbxWAR7ZoUxt.jpg,"[{u'name': u'Twentieth Century Fox Film Corporation', u'id': 306}, {u'name': u'LBI Productions', u'id': 75017}]","[{u'iso_3166_1': u'US', u'name': u'United States of America'}]",2014-04-16,196781193,109,"[{u'iso_639_1': u'en', u'name': u'English'}]",Released,The oddest friends are about to get even,The Other Woman,False,6.2,929
tt2975578,False,/zWGAnbxjjwY3xFGuOeR26LGbBlG.jpg,"{u'backdrop_path': u'/quFWGOA4I5KCTsyDbvLh6PHNZwv.jpg', u'poster_path': u'/Aklg64Q9diRCNkHy7jGYcw5twtR.jpg', u'id': 256322, u'name': u'The Purge Collection'}",9000000,"[Horror, Thriller]",,238636,en,The Purge: Anarchy,"Three groups of people are trying to survive Purge Night, when their stories intertwine and are left stranded in The Purge trying to survive the chaos and violence that occurs.",3.747557,/l1DRl40x2OWUoPP42v8fjKdS1Z3.jpg,"[{u'name': u'Universal Pictures', u'id': 33}, {u'name': u'Why Not Productions', u'id': 729}, {u'name': u'Platinum Dunes', u'id': 2481}, {u'name': u'Blumhouse Productions', u'id': 3172}, {u'name': u'5150 Action', u'id': 47354}]","[{u'iso_3166_1': u'FR', u'name': u'France'}, {u'iso_3166_1': u'US', u'name': u'United States of America'}]",2014-07-17,108782847,104,"[{u'iso_639_1': u'en', u'name': u'English'}]",Released,"Welcome to America, where one night a year, all crime Is legal.",The Purge: Anarchy,False,6.6,928
tt2321549,False,/pJ10mpKs2mM2AXTUOmM4yl5PJi8.jpg,,2000000,"[Drama, Thriller, Horror]",http://thebabadook.com/,242224,en,The Babadook,"A single mother, plagued by the violent death of her husband, battles with her son's fear of a monster lurking in the house, but soon discovers a sinister presence all around her.",1.891181,/b3YzM03YxkOaJw2PglfKlcwr8bM.jpg,"[{u'name': u'South Australian Film Corporation', u'id': 2806}, {u'name': u'Screen Australia', u'id': 7584}, {u'name': u'Smoking Gun Productions', u'id': 21181}, {u'name': u'Causeway Films', u'id': 32301}]","[{u'iso_3166_1': u'CA', u'name': u'Canada'}, {u'iso_3166_1': u'AU', u'name': u'Australia'}]",2014-05-22,6676471,93,"[{u'iso_639_1': u'en', u'name': u'English'}]",Released,"If it's in a word, or it's in a look, you can't get rid of the Babadook.",The Babadook,False,6.5,926
tt2170439,False,/7OluTl9LoaMDZ2MVdrFVuU2os09.jpg,"{u'backdrop_path': u'/9RD8qHYKr3KAJcaXp4t5SbMN4aQ.jpg', u'poster_path': u'/zU3dVVBa3JW1nQVUsaFM0BeTnK.jpg', u'id': 280588, u'name': u'Horrible Bosses Collection'}",42000000,[Comedy],,227159,en,Horrible Bosses 2,"Dale, Kurt and Nick decide to start their own business but things don't go as planned because of a slick investor, prompting the trio to pull off a harebrained and misguided kidnapping scheme.",3.360851,/zRkLCOx7o9tjPYb9s7u6mpw8VOs.jpg,"[{u'name': u'New Line Cinema', u'id': 12}, {u'name': u'BenderSpink', u'id': 6363}, {u'name': u'RatPac Entertainment', u'id': 28732}]","[{u'iso_3166_1': u'US', u'name': u'United States of America'}]",2014-11-26,106645357,108,"[{u'iso_639_1': u'en', u'name': u'English'}]",Released,New Crime. Same Tools.,Horrible Bosses 2,False,6.1,918
tt1872194,False,/eB43LYncKDJS3p5xYSUN9dUrL2A.jpg,,50000000,[Drama],http://thejudgemovie.com/,205587,en,The Judge,"A successful lawyer returns to his hometown for his mother's funeral only to discover that his estranged father, the town's judge, is suspected of murder.",2.747749,/v6s65U6qisvxWgO3cNnreaaaite.jpg,"[{u'name': u'Village Roadshow Pictures', u'id': 79}, {u'name': u'Warner Bros.', u'id': 6194}, {u'name': u'Big Kid Pictures', u'id': 8406}, {u'name': u'Team Downey', u'id': 27467}]","[{u'iso_3166_1': u'US', u'name': u'United States of America'}]",2014-10-08,83719388,141,"[{u'iso_639_1': u'en', u'name': u'English'}]",Released,Defend your Honor.,The Judge,False,7.1,882
tt1809398,False,/eSbKT3v3RKFRGeOmxJbZhIvrevR.jpg,,65000000,"[Drama, War]",http://www.unbrokenfilm.com/,227306,en,Unbroken,"A chronicle of the life of Louis Zamperini, an Olympic runner who was taken prisoner by Japanese forces during World War II.",2.273856,/qvRHvtjNfvq0R0IwV2oVmW6DduS.jpg,"[{u'name': u'Legendary Pictures', u'id': 923}, {u'name': u'3 Arts Entertainment', u'id': 36390}, {u'name': u'Jolie Pas', u'id': 39443}]","[{u'iso_3166_1': u'US', u'name': u'United States of America'}]",2014-12-25,163442937,137,"[{u'iso_639_1': u'it', u'name': u'Italiano'}, {u'iso_639_1': u'en', u'name': u'English'}, {u'iso_639_1': u'ja', u'name': u'日本語'}]",Released,Survival. Resilience. Redemption,Unbroken,False,7.2,871
tt1911658,False,/fBYnaVOcc2Ghfkv473z0xdBRQ0m.jpg,,132000000,"[Family, Animation, Adventure, Comedy]",,270946,en,Penguins of Madagascar,"Skipper, Kowalski, Rico and Private join forces with undercover organization The North Wind to stop the villainous Dr. Octavius Brine from destroying the world as we know it.",1.984782,/pRer59eyY4rjkLPeKXKo7fPxCHH.jpg,"[{u'name': u'DreamWorks Animation', u'id': 521}]","[{u'iso_3166_1': u'US', u'name': u'United States of America'}]",2014-11-22,373552094,92,"[{u'iso_639_1': u'en', u'name': u'English'}]",Released,The Movie Event That Will Blow Their Cover,Penguins of Madagascar,False,6.6,832
