imdb_id,adult,backdrop_path,belongs_to_collection,budget,genres,homepage,tmdb_id,original_language,original_title,overview,tmdb_popularity,poster_path,production_companies,production_countries,release_date,revenue,runtime,spoken_languages,status,tagline,title,video,tmdb_vote_average,tmdb_vote_count
tt1618442,False,/o6saqjLAgKpczr0yhJkEI9fNwN7.jpg,,90000000,"[Fantasy, Action, Adventure]",http://www.thelastwitchhunter.movie/,274854,en,The Last Witch Hunter,"The modern world holds many secrets, but by far the most astounding is that witches still live among us; vicious supernatural creatures intent on unleashing the Black Death upon the world and putting an end to the human race once and for all. Armies of witch hunters have battled this unnatural enemy for centuries, including Kaulder, a valiant warrior who many years ago slayed the all-powerful Witch Queen, decimating her followers in the process. In the moments right before her death, the Queen cursed Kaulder with immortality, forever separating him from his beloved wife and daughter. Today, Kaulder is the last living hunter who has spent his immortal life tracking down rogue witches, all the while yearning for his long-lost family.",2.741681,/xw1GFKzxjgfm3dQoK1swFcHmfaC.jpg,"[{u'name': u'Summit Entertainment', u'id': 491}, {u'name': u'Atmosphere Entertainment MM', u'id': 2995}, {u'name': u'One Race Films', u'id': 7154}, {u'name': u'Goldmann Pictures', u'id': 12006}, {u'name': u'NeoReel', u'id': 24097}, {u'name': u'Aperture Entertainment', u'id': 33832}, {u'name': u'TIK Films', u'id': 72441}]","[{u'iso_3166_1': u'US', u'name': u'United States of America'}]",2015-10-21,140396650,106,"[{u'iso_639_1': u'en', u'name': u'English'}]",Released,Hunt forever.,The Last Witch Hunter,False,5.5,717
tt2679042,False,/EnWldA0LlltnAhKjmBZci6Y4Lc.jpg,"{u'backdrop_path': u'/weBIyv0mOydPd0GYJl9iDR3RscM.jpg', u'poster_path': u'/3wYKmCgRmpHQsJAbfGM0axs3gos.jpg', u'id': 390096, u'name': u'Hitman Collection'}",35000000,"[Action, Crime, Thriller]",http://www.foxmovies.com/movies/hitman-agent-47,249070,en,Hitman: Agent 47,An assassin teams up with a woman to help her find her father and uncover the mysteries of her ancestry.,2.351532,/4VmZeT8YkuMI6BrA623mHZDISlN.jpg,"[{u'name': u'Twentieth Century Fox Film Corporation', u'id': 306}, {u'name': u'Fox International Productions', u'id': 7485}, {u'name': u'Infinite Frameworks Studios', u'id': 14446}, {u'name': u'TSG Entertainment', u'id': 22213}]","[{u'iso_3166_1': u'ID', u'name': u'Indonesia'}, {u'iso_3166_1': u'DE', u'name': u'Germany'}, {u'iso_3166_1': u'US', u'name': u'United States of America'}]",2015-08-20,0,96,"[{u'iso_639_1': u'en', u'name': u'English'}]",Released,Your Number is Up.,Hitman: Agent 47,False,5.5,713
tt1355683,False,/fop31RWFi9sVL0xK5hAJGh7Fwkz.jpg,,53000000,"[Crime, Drama]",,261023,en,Black Mass,"The true story of Whitey Bulger, the brother of a state senator and the most infamous violent criminal in the history of South Boston, who became an FBI informant to take down a Mafia family invading his turf.",2.731508,/yIVnNriiyl522hk3LFLJrrMovhP.jpg,"[{u'name': u'Infinitum Nihil', u'id': 2691}, {u'name': u'Head Gear Films', u'id': 5056}, {u'name': u'Cross Creek Pictures', u'id': 10246}, {u'name': u'Free State Pictures', u'id': 40106}, {u'name': u'RatPac-Dune Entertainment', u'id': 41624}, {u'name': u'Le Grisbi Productions', u'id': 47169}, {u'name': u'Vendian Entertainment', u'id': 50481}]","[{u'iso_3166_1': u'GB', u'name': u'United Kingdom'}, {u'iso_3166_1': u'US', u'name': u'United States of America'}]",2015-09-04,99775678,122,"[{u'iso_639_1': u'en', u'name': u'English'}]",Released,Keep your enemies close.,Black Mass,False,6.2,711
tt2554274,False,/t8wLhfVbfCHbirEgDPQhiuLcFGp.jpg,,55000000,"[Mystery, Thriller, Fantasy, Horror, Drama]",http://www.crimsonpeakmovie.com/,201085,en,Crimson Peak,"In the aftermath of a family tragedy, an aspiring author is torn between love for her childhood friend and the temptation of a mysterious outsider. Trying to escape the ghosts of her past, she is swept away to a house that breathes, bleeds… and remembers.",2.737114,/pCj8zem1NDAODdtvha9WFEB6iWR.jpg,"[{u'name': u'Legendary Pictures', u'id': 923}]","[{u'iso_3166_1': u'CA', u'name': u'Canada'}, {u'iso_3166_1': u'US', u'name': u'United States of America'}]",2015-10-13,74679822,119,"[{u'iso_639_1': u'en', u'name': u'English'}]",Released,Beware.,Crimson Peak,False,6.3,687
tt1390411,False,/vJfivaGbEvDLJgZGthUUVBLeFB5.jpg,,100000000,"[Thriller, Drama, Adventure, Action, History]",http://www.intheheartoftheseamovie.com/,205775,en,In the Heart of the Sea,"In the winter of 1820, the New England whaling ship Essex was assaulted by something no one could believe: a whale of mammoth size and will, and an almost human sense of vengeance.  The real-life maritime disaster would inspire Herman Melville’s Moby Dick.  But that told only half the story.  “Heart of the Sea” reveals the encounter’s harrowing aftermath, as the ship’s surviving crew is pushed to their limits and forced to do the unthinkable to stay alive.  Braving storms, starvation, panic and despair, the men will call into question their deepest beliefs, from the value of their lives to the morality of their trade, as their captain searches for direction on the open sea and his first mate still seeks to bring the great whale down.",3.374706,/uekIGnzTACciWrfR7jOuof7xHgR.jpg,"[{u'name': u'Imagine Entertainment', u'id': 23}, {u'name': u'Spring Creek Productions', u'id': 705}, {u'name': u'Warner Bros.', u'id': 6194}, {u'name': u'Roth Films', u'id': 16314}, {u'name': u'K. JAM Media', u'id': 17888}, {u'name': u'Cott Productions', u'id': 24175}, {u'name': u'Surf Film', u'id': 34401}, {u'name': u'Enelmar Productions, A.I.E.', u'id': 63571}]","[{u'iso_3166_1': u'CA', u'name': u'Canada'}, {u'iso_3166_1': u'US', u'name': u'United States of America'}, {u'iso_3166_1': u'AU', u'name': u'Australia'}, {u'iso_3166_1': u'ES', u'name': u'Spain'}, {u'iso_3166_1': u'GB', u'name': u'United Kingdom'}]",2015-11-20,93820758,122,"[{u'iso_639_1': u'en', u'name': u'English'}]",Released,Based on the incredible true story that inspired Moby Dick,In the Heart of the Sea,False,6.3,683
tt3045616,False,/wNnuYx5tMiVEnru3zJS85kSzzRs.jpg,,60000000,"[Comedy, Adventure]",http://mortdecaithemovie.com/,210860,en,Mortdecai,"Art dealer, Charles Mortdecai, searches for a stolen painting rumored to contain a secret code that gains access to hidden Nazi gold.",3.900398,/56rS3ipzekH2VlHpnH8VOTkKjwR.jpg,"[{u'name': u'Lionsgate', u'id': 1632}, {u'name': u'Mad Chance', u'id': 1757}, {u'name': u'OddLot Entertainment', u'id': 36209}, {u'name': u'Huayi Brothers Media', u'id': 39649}]","[{u'iso_3166_1': u'US', u'name': u'United States of America'}]",2015-01-21,30418560,106,"[{u'iso_639_1': u'en', u'name': u'English'}]",Released,Sophistication Has a Name.,Mortdecai,False,5.4,624
tt0810819,False,/oXRoRYROJdoi7so8H9cHzS9jp6K.jpg,,15000000,[Drama],,306819,en,The Danish Girl,"When Gerda Wegener asks her husband Einar to fill in as a portrait model, Einar discovers the person she's meant to be and begins living her life as Lili Elbe. Having realized her true self and with Gerda's love and support, Lili embarks on a groundbreaking journey as a transgender pioneer.",1.423413,/seWQ6UKCrhGH0eP7dFZvmIBQtKF.jpg,"[{u'name': u'Pretty Pictures', u'id': 8875}, {u'name': u'Working Title Films', u'id': 10163}, {u'name': u'Artémis Productions', u'id': 11773}, {u'name': u'Le Tax Shelter du Gouvernement Fédéral de Belgique', u'id': 11921}, {u'name': u'Taxshelter. be', u'id': 11922}, {u'name': u'Shelter Productions', u'id': 23200}, {u'name': u'Senator Global Productions', u'id': 73536}, {u'name': u'Kvinde Films', u'id': 73537}, {u'name': u'ReVision Pictures', u'id': 73538}, {u'name': u'Copenhagen Film Fund', u'id': 73539}]","[{u'iso_3166_1': u'DE', u'name': u'Germany'}, {u'iso_3166_1': u'GB', u'name': u'United Kingdom'}, {u'iso_3166_1': u'US', u'name': u'United States of America'}, {u'iso_3166_1': u'BE', u'name': u'Belgium'}, {u'iso_3166_1': u'DK', u'name': u'Denmark'}]",2015-11-27,64191523,120,"[{u'iso_639_1': u'en', u'name': u'English'}, {u'iso_639_1': u'fr', u'name': u'Français'}, {u'iso_639_1': u'de', u'name': u'Deutsch'}]",Released,Find the courage to be yourself.,The Danish Girl,False,7.1,624
